Pathway	Count	Length	Genes	GeneList	GeneCount	AvgGeneFrequency	SharedGeneFraction	UniqueGeneFraction
Pyruvate metabolism	1	47	PDHA2, ACYP1, MDH2, PDHA1, PKLR, ACOT12, AKR1A1, ACYP2, GRHPR, PKM, ALDH3A2, ALDH7A1, PC, HAGH, DLD, ALDH9A1, LDHAL6A, LDHAL6B, FH, ADH1C, ADH1B, ADH1A, GLO1, ACAT1, PDHB, ACACB, ADH6, ACACA, ACAT2, ADH7, ADH4, LDHD, ADH5, LDHC, LDHB, LDHA, ALDH1B1, ALDH2, ME2, ME1, DLAT, MDH1, ME3, ACSS2, PCK2, ACSS1, PCK1	['PDHA2', 'ACYP1', 'MDH2', 'PDHA1', 'PKLR', 'ACOT12', 'AKR1A1', 'ACYP2', 'GRHPR', 'PKM', 'ALDH3A2', 'ALDH7A1', 'PC', 'HAGH', 'DLD', 'ALDH9A1', 'LDHAL6A', 'LDHAL6B', 'FH', 'ADH1C', 'ADH1B', 'ADH1A', 'GLO1', 'ACAT1', 'PDHB', 'ACACB', 'ADH6', 'ACACA', 'ACAT2', 'ADH7', 'ADH4', 'LDHD', 'ADH5', 'LDHC', 'LDHB', 'LDHA', 'ALDH1B1', 'ALDH2', 'ME2', 'ME1', 'DLAT', 'MDH1', 'ME3', 'ACSS2', 'PCK2', 'ACSS1', 'PCK1']	47	6.25531914893617	0.851063829787234	0.14893617021276595
Tryptophan metabolism	2	42	AADAT, AOC1, KYAT1, INMT, KMO, ALDH3A2, ALDH7A1, CAT, HADHA, CYP1A2, CYP1A1, DLD, KYAT3, ALDH9A1, ALDH8A1, GCDH, IDO1, IDO2, DHTKD1, TPH2, DDC, TPH1, MAOB, ASMT, MAOA, HAAO, ACAT1, ACMSD, DLST, EHHADH, ECHS1, ACAT2, IL4I1, AANAT, ALDH1B1, ALDH2, TDO2, AFMID, KYNU, AOX1, CYP1B1, HADH	['AADAT', 'AOC1', 'KYAT1', 'INMT', 'KMO', 'ALDH3A2', 'ALDH7A1', 'CAT', 'HADHA', 'CYP1A2', 'CYP1A1', 'DLD', 'KYAT3', 'ALDH9A1', 'ALDH8A1', 'GCDH', 'IDO1', 'IDO2', 'DHTKD1', 'TPH2', 'DDC', 'TPH1', 'MAOB', 'ASMT', 'MAOA', 'HAAO', 'ACAT1', 'ACMSD', 'DLST', 'EHHADH', 'ECHS1', 'ACAT2', 'IL4I1', 'AANAT', 'ALDH1B1', 'ALDH2', 'TDO2', 'AFMID', 'KYNU', 'AOX1', 'CYP1B1', 'HADH']	42	5.690476190476191	0.8095238095238095	0.19047619047619047
Dopaminergic synapse	1	132	PPP2R1A, MAPK13, PPP1CA, MAPK14, PPP1CB, MAPK11, MAPK12, MAPK10, CALM2, CALM3, CALM1, ATF2, CALML6, ATF6B, ADCY5, CALML3, CALML4, CALML5, COMT, ARNTL, GNG2, KIF5A, PPP1CC, CREB3L1, GNG4, GNG3, CREB3L4, GNG5, AKT3, CREB3L2, GNG8, KIF5C, CREB3L3, GNG7, KIF5B, AKT1, AKT2, PRKCG, PRKCB, PRKCA, CREB3, GNAL, CREB1, GNB1, PPP1R1B, GNB3, GNAQ, GNB2, GNB5, GNAS, GNB4, LRTOMT, ATF4, CREB5, GRIA2, GRIA3, GRIA1, CACNA1A, CACNA1C, CACNA1B, CACNA1D, SLC6A3, PRKACG, GNG11, GRIN2B, GNG10, GRIN2A, PRKACB, SCN1A, GRIA4, PRKACA, KCNJ5, KCNJ6, KCNJ9, PPP2R5C, PPP2R5B, PPP2R5E, PPP2R5D, GNG13, GNG12, PPP2R5A, TH, CALY, GNAO1, GSK3B, GSK3A, MAOB, MAOA, ITPR2, ITPR3, ITPR1, GNGT2, PPP3CA, GNGT1, PPP3CB, PPP3CC, DRD1, DRD2, DRD3, SLC18A1, DRD4, SLC18A2, DRD5, FOS, PPP2R3A, PPP2R3C, PPP2R3B, PPP2CA, PLCB4, PPP2R2D, PPP2R2C, PLCB2, PLCB3, CLOCK, PLCB1, CAMK2D, DDC, CAMK2A, CAMK2B, ARRB2, PPP2R2B, PPP2R2A, GNAI1, GNAI2, GNAI3, PPP2CB, MAPK9, MAPK8, ARRB1, PPP2R1B, CAMK2G, KCNJ3	['PPP2R1A', 'MAPK13', 'PPP1CA', 'MAPK14', 'PPP1CB', 'MAPK11', 'MAPK12', 'MAPK10', 'CALM2', 'CALM3', 'CALM1', 'ATF2', 'CALML6', 'ATF6B', 'ADCY5', 'CALML3', 'CALML4', 'CALML5', 'COMT', 'ARNTL', 'GNG2', 'KIF5A', 'PPP1CC', 'CREB3L1', 'GNG4', 'GNG3', 'CREB3L4', 'GNG5', 'AKT3', 'CREB3L2', 'GNG8', 'KIF5C', 'CREB3L3', 'GNG7', 'KIF5B', 'AKT1', 'AKT2', 'PRKCG', 'PRKCB', 'PRKCA', 'CREB3', 'GNAL', 'CREB1', 'GNB1', 'PPP1R1B', 'GNB3', 'GNAQ', 'GNB2', 'GNB5', 'GNAS', 'GNB4', 'LRTOMT', 'ATF4', 'CREB5', 'GRIA2', 'GRIA3', 'GRIA1', 'CACNA1A', 'CACNA1C', 'CACNA1B', 'CACNA1D', 'SLC6A3', 'PRKACG', 'GNG11', 'GRIN2B', 'GNG10', 'GRIN2A', 'PRKACB', 'SCN1A', 'GRIA4', 'PRKACA', 'KCNJ5', 'KCNJ6', 'KCNJ9', 'PPP2R5C', 'PPP2R5B', 'PPP2R5E', 'PPP2R5D', 'GNG13', 'GNG12', 'PPP2R5A', 'TH', 'CALY', 'GNAO1', 'GSK3B', 'GSK3A', 'MAOB', 'MAOA', 'ITPR2', 'ITPR3', 'ITPR1', 'GNGT2', 'PPP3CA', 'GNGT1', 'PPP3CB', 'PPP3CC', 'DRD1', 'DRD2', 'DRD3', 'SLC18A1', 'DRD4', 'SLC18A2', 'DRD5', 'FOS', 'PPP2R3A', 'PPP2R3C', 'PPP2R3B', 'PPP2CA', 'PLCB4', 'PPP2R2D', 'PPP2R2C', 'PLCB2', 'PLCB3', 'CLOCK', 'PLCB1', 'CAMK2D', 'DDC', 'CAMK2A', 'CAMK2B', 'ARRB2', 'PPP2R2B', 'PPP2R2A', 'GNAI1', 'GNAI2', 'GNAI3', 'PPP2CB', 'MAPK9', 'MAPK8', 'ARRB1', 'PPP2R1B', 'CAMK2G', 'KCNJ3']	132	28.09090909090909	0.9848484848484849	0.015151515151515138
Glutamatergic synapse	1	114	HOMER2, HOMER3, HOMER1, GRIN2D, GRIN2C, GRIN1, GRIN3A, GRIN3B, GLS2, ADCY1, SLC1A1, SLC1A2, ADCY5, SLC1A3, ADCY4, ADCY3, ADCY2, SLC1A6, ADCY9, GLS, SLC1A7, ADCY8, ADCY7, ADCY6, GNG2, GNG4, GNG3, GNG5, GNG8, GNG7, PRKCG, SLC38A2, SLC38A1, PLA2G4E, PLA2G4F, PLA2G4C, PLA2G4D, PLA2G4A, PLA2G4B, PRKCB, PRKCA, DLG4, GNB1, GNB3, GNAQ, GNB2, GNB5, GNAS, GNB4, GRIA2, GRIA3, GRIA1, CACNA1A, CACNA1C, CACNA1D, PPP3R1, PRKACG, GNG11, GRIN2B, PPP3R2, GNG10, GRIN2A, GLUL, PRKACB, SLC38A3, GRIA4, PRKACA, GNG13, GNG12, SHANK1, GNAO1, SHANK3, SHANK2, GRIK4, ITPR2, GRIK5, ITPR3, GRIK2, GRIK3, PLD2, GRIK1, PLD1, ITPR1, GNGT2, GRK2, PPP3CA, GNGT1, PPP3CB, PPP3CC, GRK3, TRPC1, DLGAP1, PLCB4, JMJD7-PLA2G4B, PLCB2, PLCB3, PLCB1, GNAI1, GNAI2, GRM2, GNAI3, GRM1, GRM4, GRM3, GRM6, GRM5, GRM8, GRM7, MAPK3, SLC17A6, SLC17A7, MAPK1, SLC17A8, KCNJ3	['HOMER2', 'HOMER3', 'HOMER1', 'GRIN2D', 'GRIN2C', 'GRIN1', 'GRIN3A', 'GRIN3B', 'GLS2', 'ADCY1', 'SLC1A1', 'SLC1A2', 'ADCY5', 'SLC1A3', 'ADCY4', 'ADCY3', 'ADCY2', 'SLC1A6', 'ADCY9', 'GLS', 'SLC1A7', 'ADCY8', 'ADCY7', 'ADCY6', 'GNG2', 'GNG4', 'GNG3', 'GNG5', 'GNG8', 'GNG7', 'PRKCG', 'SLC38A2', 'SLC38A1', 'PLA2G4E', 'PLA2G4F', 'PLA2G4C', 'PLA2G4D', 'PLA2G4A', 'PLA2G4B', 'PRKCB', 'PRKCA', 'DLG4', 'GNB1', 'GNB3', 'GNAQ', 'GNB2', 'GNB5', 'GNAS', 'GNB4', 'GRIA2', 'GRIA3', 'GRIA1', 'CACNA1A', 'CACNA1C', 'CACNA1D', 'PPP3R1', 'PRKACG', 'GNG11', 'GRIN2B', 'PPP3R2', 'GNG10', 'GRIN2A', 'GLUL', 'PRKACB', 'SLC38A3', 'GRIA4', 'PRKACA', 'GNG13', 'GNG12', 'SHANK1', 'GNAO1', 'SHANK3', 'SHANK2', 'GRIK4', 'ITPR2', 'GRIK5', 'ITPR3', 'GRIK2', 'GRIK3', 'PLD2', 'GRIK1', 'PLD1', 'ITPR1', 'GNGT2', 'GRK2', 'PPP3CA', 'GNGT1', 'PPP3CB', 'PPP3CC', 'GRK3', 'TRPC1', 'DLGAP1', 'PLCB4', 'JMJD7-PLA2G4B', 'PLCB2', 'PLCB3', 'PLCB1', 'GNAI1', 'GNAI2', 'GRM2', 'GNAI3', 'GRM1', 'GRM4', 'GRM3', 'GRM6', 'GRM5', 'GRM8', 'GRM7', 'MAPK3', 'SLC17A6', 'SLC17A7', 'MAPK1', 'SLC17A8', 'KCNJ3']	114	24.096491228070175	0.9649122807017544	0.03508771929824561
ErbB signaling pathway	1	85	EGF, JUN, BAD, GAB1, NRG1, NRG2, BRAF, NRG3, BUB1B-PAK6, EREG, MAPK10, NRG4, PIK3CB, PIK3CA, SOS2, RAF1, SOS1, GSK3B, SHC3, SHC4, SHC1, SHC2, PIK3R3, TGFA, ARAF, CBLB, PIK3R2, AREG, EGFR, CRKL, NRAS, PAK2, PAK1, ERBB4, AKT3, ERBB2, ERBB3, MYC, AKT1, AKT2, PAK4, PAK3, PAK6, PAK5, MAP2K4, STAT5B, PRKCG, MAP2K2, MAP2K1, PRKCB, PRKCA, MTOR, PTK2, BTC, PIK3R1, RPS6KB2, RPS6KB1, CRK, GRB2, KRAS, HBEGF, CAMK2D, CDKN1B, SRC, CDKN1A, CAMK2A, CAMK2B, EIF4EBP1, PIK3CD, ELK1, CBL, MAPK9, MAPK8, ABL2, MAPK3, HRAS, MAPK1, PLCG1, ABL1, PLCG2, CAMK2G, NCK1, MAP2K7, NCK2, STAT5A	['EGF', 'JUN', 'BAD', 'GAB1', 'NRG1', 'NRG2', 'BRAF', 'NRG3', 'BUB1B-PAK6', 'EREG', 'MAPK10', 'NRG4', 'PIK3CB', 'PIK3CA', 'SOS2', 'RAF1', 'SOS1', 'GSK3B', 'SHC3', 'SHC4', 'SHC1', 'SHC2', 'PIK3R3', 'TGFA', 'ARAF', 'CBLB', 'PIK3R2', 'AREG', 'EGFR', 'CRKL', 'NRAS', 'PAK2', 'PAK1', 'ERBB4', 'AKT3', 'ERBB2', 'ERBB3', 'MYC', 'AKT1', 'AKT2', 'PAK4', 'PAK3', 'PAK6', 'PAK5', 'MAP2K4', 'STAT5B', 'PRKCG', 'MAP2K2', 'MAP2K1', 'PRKCB', 'PRKCA', 'MTOR', 'PTK2', 'BTC', 'PIK3R1', 'RPS6KB2', 'RPS6KB1', 'CRK', 'GRB2', 'KRAS', 'HBEGF', 'CAMK2D', 'CDKN1B', 'SRC', 'CDKN1A', 'CAMK2A', 'CAMK2B', 'EIF4EBP1', 'PIK3CD', 'ELK1', 'CBL', 'MAPK9', 'MAPK8', 'ABL2', 'MAPK3', 'HRAS', 'MAPK1', 'PLCG1', 'ABL1', 'PLCG2', 'CAMK2G', 'NCK1', 'MAP2K7', 'NCK2', 'STAT5A']	85	38.67058823529412	0.9882352941176471	0.0117647058823529
Tight junction	1	169	MAP3K1, ACTN4, ACTN1, RUNX1, TJAP1, PPP2R1A, SCRIB, PRKAB1, PRKAB2, TUBA4A, TUBA8, MYL6, MAPK10, MYL2, AMOTL1, AMOTL2, MYL9, PCNA, PRKAA2, ROCK1, ROCK2, TUBAL3, ARPC5L, CLDN3, TUBA3C, CLDN2, PRKAA1, AMOT, CLDN1, MYL12B, PARD6G, PARD6A, ACTB, TUBA3E, PARD6B, TUBA3D, CCND1, MICALL2, MYH14, JAM2, MYH10, MYH11, BVES, JAM3, MAP3K5, PRKCI, ARHGEF18, PRKCE, PARD3, ARPC5, SLC9A3R1, VASP, DLG1, MYL12A, OCLN, DLG2, PRKCZ, DLG3, ARPC3, ARPC4, ARPC2, EZR, CFTR, PATJ, ACTG1, NEDD4L, ARHGAP17, CACNA1D, CD1E, F11R, GATA4, ACTR3B, CD1D, ACTR3C, CD1C, MYL6B, CD1B, CD1A, PRKACG, STK11, PRKACB, SYNPO, MAP2K7, PRKACA, ACTR3, RHOA, ACTR2, JUN, RDX, MSN, CGN, HSPA4, AFDN, CLDN11, CLDN10, RAP2C, CLDN16, CLDN15, CDK4, CLDN14, MYH9, NF2, RAPGEF2, CLDN19, ARHGEF2, CLDN18, CLDN17, RAPGEF6, PALS1, ARPC1A, WHAMM, IGSF5, ARPC1B, RAP1A, MARVELD3, MARVELD2, ERBB2, SYMPK, MPDZ, CGNL1, MAGI1, MPP4, TIAM1, CDC42, PPP2CA, CLDN34, CLDN7, TJP2, CLDN6, TJP1, CLDN5, CLDN4, PPP2R2D, CTTN, PPP2R2C, CLDN9, RAB13, CLDN8, NEDD4, HCLS1, LLGL1, LLGL2, TJP3, CRB3, ITGB1, SRC, PRKAG2, PRKAG3, WAS, PPP2R2B, YBX3, PPP2R2A, PRKAG1, TUBA1A, CLDN23, PPP2CB, CLDN22, EPB41L4B, MAPK9, TUBA1C, CLDN20, MAPK8, TUBA1B, PPP2R1B, CLDN25, CLDN24, RAB8A, RAC1, RAB8B	['MAP3K1', 'ACTN4', 'ACTN1', 'RUNX1', 'TJAP1', 'PPP2R1A', 'SCRIB', 'PRKAB1', 'PRKAB2', 'TUBA4A', 'TUBA8', 'MYL6', 'MAPK10', 'MYL2', 'AMOTL1', 'AMOTL2', 'MYL9', 'PCNA', 'PRKAA2', 'ROCK1', 'ROCK2', 'TUBAL3', 'ARPC5L', 'CLDN3', 'TUBA3C', 'CLDN2', 'PRKAA1', 'AMOT', 'CLDN1', 'MYL12B', 'PARD6G', 'PARD6A', 'ACTB', 'TUBA3E', 'PARD6B', 'TUBA3D', 'CCND1', 'MICALL2', 'MYH14', 'JAM2', 'MYH10', 'MYH11', 'BVES', 'JAM3', 'MAP3K5', 'PRKCI', 'ARHGEF18', 'PRKCE', 'PARD3', 'ARPC5', 'SLC9A3R1', 'VASP', 'DLG1', 'MYL12A', 'OCLN', 'DLG2', 'PRKCZ', 'DLG3', 'ARPC3', 'ARPC4', 'ARPC2', 'EZR', 'CFTR', 'PATJ', 'ACTG1', 'NEDD4L', 'ARHGAP17', 'CACNA1D', 'CD1E', 'F11R', 'GATA4', 'ACTR3B', 'CD1D', 'ACTR3C', 'CD1C', 'MYL6B', 'CD1B', 'CD1A', 'PRKACG', 'STK11', 'PRKACB', 'SYNPO', 'MAP2K7', 'PRKACA', 'ACTR3', 'RHOA', 'ACTR2', 'JUN', 'RDX', 'MSN', 'CGN', 'HSPA4', 'AFDN', 'CLDN11', 'CLDN10', 'RAP2C', 'CLDN16', 'CLDN15', 'CDK4', 'CLDN14', 'MYH9', 'NF2', 'RAPGEF2', 'CLDN19', 'ARHGEF2', 'CLDN18', 'CLDN17', 'RAPGEF6', 'PALS1', 'ARPC1A', 'WHAMM', 'IGSF5', 'ARPC1B', 'RAP1A', 'MARVELD3', 'MARVELD2', 'ERBB2', 'SYMPK', 'MPDZ', 'CGNL1', 'MAGI1', 'MPP4', 'TIAM1', 'CDC42', 'PPP2CA', 'CLDN34', 'CLDN7', 'TJP2', 'CLDN6', 'TJP1', 'CLDN5', 'CLDN4', 'PPP2R2D', 'CTTN', 'PPP2R2C', 'CLDN9', 'RAB13', 'CLDN8', 'NEDD4', 'HCLS1', 'LLGL1', 'LLGL2', 'TJP3', 'CRB3', 'ITGB1', 'SRC', 'PRKAG2', 'PRKAG3', 'WAS', 'PPP2R2B', 'YBX3', 'PPP2R2A', 'PRKAG1', 'TUBA1A', 'CLDN23', 'PPP2CB', 'CLDN22', 'EPB41L4B', 'MAPK9', 'TUBA1C', 'CLDN20', 'MAPK8', 'TUBA1B', 'PPP2R1B', 'CLDN25', 'CLDN24', 'RAB8A', 'RAC1', 'RAB8B']	169	10.85207100591716	0.8757396449704142	0.12426035502958577
Focal adhesion	2	201	EGF, ACTN4, BAD, ACTN1, COL1A2, MYL5, COL1A1, MYL7, MAPK10, MYL2, COL9A2, COL9A1, COL9A3, MYL9, TLN2, TLN1, MYL12B, CRKL, ACTB, AKT3, AKT1, MYL10, AKT2, KDR, PRKCG, IGF1, PRKCB, PRKCA, PTK2, VASP, COL2A1, MYL12A, MYLPF, PIK3R1, GRB2, PDGFC, PDGFB, PDGFA, ELK1, MYLK, PDGFD, PIP5K1A, PIP5K1B, PIP5K1C, RHOA, JUN, VEGFC, FN1, VEGFD, BRAF, VAV1, VAV2, VEGFA, VAV3, VEGFB, RAPGEF1, RAP1A, RAP1B, COL4A1, COL4A3, COL4A2, COL4A5, XIAP, COL4A4, COL4A6, CTNNB1, RAC3, HRAS, RAC1, RAC2, PDGFRB, PDGFRA, BUB1B-PAK6, PPP1CA, PPP1CB, ITGA10, ITGA11, ZYX, RAF1, ROCK1, ROCK2, TNXB, ITGA2B, TNC, EGFR, ARHGAP35, PPP1CC, COMP, PAK2, RELN, TNN, CCND3, PAK1, CCND2, CCND1, TNR, FLNA, FLNB, FLNC, CAPN2, SPP1, PAK4, PAK3, PAK6, PAK5, MAP2K1, HGF, PGF, DIAPH1, COL6A1, COL6A3, COL6A2, COL6A5, COL6A6, BIRC2, BIRC3, VCL, PXN, ACTG1, IGF1R, VTN, ARHGAP5, IBSP, CHAD, ITGA1, PPP1R12A, PPP1R12B, ITGA5, LAMB4, CAV3, ITGA4, LAMB3, CAV2, ITGA3, CAV1, ITGA2, LAMB2, PARVB, LAMB1, PARVA, PIK3CB, PIK3CA, PARVG, ITGA9, BCL2, ITGA8, ITGA7, ITGA6, PPP1R12C, SOS2, DOCK1, BCAR1, SOS1, GSK3B, SHC3, SHC4, RASGRF1, SHC1, SHC2, ILK, LAMC1, LAMC3, PIK3R3, LAMC2, PIK3R2, ERBB2, VWF, PDPK1, CDC42, CRK, MET, MYLK2, ITGB1, MYLK3, FLT1, SRC, ITGB6, LAMA3, FLT4, ITGB5, LAMA2, ITGB4, LAMA5, ITGB3, LAMA4, PTEN, LAMA1, PIK3CD, THBS1, THBS3, THBS2, MYLK4, THBS4, MAPK9, MAPK8, MAPK3, ITGB8, MAPK1, FYN, ITGAV, ITGB7	['EGF', 'ACTN4', 'BAD', 'ACTN1', 'COL1A2', 'MYL5', 'COL1A1', 'MYL7', 'MAPK10', 'MYL2', 'COL9A2', 'COL9A1', 'COL9A3', 'MYL9', 'TLN2', 'TLN1', 'MYL12B', 'CRKL', 'ACTB', 'AKT3', 'AKT1', 'MYL10', 'AKT2', 'KDR', 'PRKCG', 'IGF1', 'PRKCB', 'PRKCA', 'PTK2', 'VASP', 'COL2A1', 'MYL12A', 'MYLPF', 'PIK3R1', 'GRB2', 'PDGFC', 'PDGFB', 'PDGFA', 'ELK1', 'MYLK', 'PDGFD', 'PIP5K1A', 'PIP5K1B', 'PIP5K1C', 'RHOA', 'JUN', 'VEGFC', 'FN1', 'VEGFD', 'BRAF', 'VAV1', 'VAV2', 'VEGFA', 'VAV3', 'VEGFB', 'RAPGEF1', 'RAP1A', 'RAP1B', 'COL4A1', 'COL4A3', 'COL4A2', 'COL4A5', 'XIAP', 'COL4A4', 'COL4A6', 'CTNNB1', 'RAC3', 'HRAS', 'RAC1', 'RAC2', 'PDGFRB', 'PDGFRA', 'BUB1B-PAK6', 'PPP1CA', 'PPP1CB', 'ITGA10', 'ITGA11', 'ZYX', 'RAF1', 'ROCK1', 'ROCK2', 'TNXB', 'ITGA2B', 'TNC', 'EGFR', 'ARHGAP35', 'PPP1CC', 'COMP', 'PAK2', 'RELN', 'TNN', 'CCND3', 'PAK1', 'CCND2', 'CCND1', 'TNR', 'FLNA', 'FLNB', 'FLNC', 'CAPN2', 'SPP1', 'PAK4', 'PAK3', 'PAK6', 'PAK5', 'MAP2K1', 'HGF', 'PGF', 'DIAPH1', 'COL6A1', 'COL6A3', 'COL6A2', 'COL6A5', 'COL6A6', 'BIRC2', 'BIRC3', 'VCL', 'PXN', 'ACTG1', 'IGF1R', 'VTN', 'ARHGAP5', 'IBSP', 'CHAD', 'ITGA1', 'PPP1R12A', 'PPP1R12B', 'ITGA5', 'LAMB4', 'CAV3', 'ITGA4', 'LAMB3', 'CAV2', 'ITGA3', 'CAV1', 'ITGA2', 'LAMB2', 'PARVB', 'LAMB1', 'PARVA', 'PIK3CB', 'PIK3CA', 'PARVG', 'ITGA9', 'BCL2', 'ITGA8', 'ITGA7', 'ITGA6', 'PPP1R12C', 'SOS2', 'DOCK1', 'BCAR1', 'SOS1', 'GSK3B', 'SHC3', 'SHC4', 'RASGRF1', 'SHC1', 'SHC2', 'ILK', 'LAMC1', 'LAMC3', 'PIK3R3', 'LAMC2', 'PIK3R2', 'ERBB2', 'VWF', 'PDPK1', 'CDC42', 'CRK', 'MET', 'MYLK2', 'ITGB1', 'MYLK3', 'FLT1', 'SRC', 'ITGB6', 'LAMA3', 'FLT4', 'ITGB5', 'LAMA2', 'ITGB4', 'LAMA5', 'ITGB3', 'LAMA4', 'PTEN', 'LAMA1', 'PIK3CD', 'THBS1', 'THBS3', 'THBS2', 'MYLK4', 'THBS4', 'MAPK9', 'MAPK8', 'MAPK3', 'ITGB8', 'MAPK1', 'FYN', 'ITGAV', 'ITGB7']	201	21.00497512437811	0.9800995024875622	0.01990049751243783
Growth hormone synthesis, secretion and action	2	119	MAP3K1, MAPK13, MAPK14, MAPK11, MAPK12, SST, MAPK10, ADCY10, RAF1, ATF2, ADCY1, IGFALS, ATF6B, ADCY5, ADCY4, ADCY3, ADCY2, ADCY9, ADCY8, ADCY7, ADCY6, CRKL, CREB3L1, NRAS, CREB3L4, AKT3, CREB3L2, CREB3L3, AKT1, AKT2, GHSR, MAP2K4, STAT5B, CREBBP, PRKCG, MAP2K2, MAP2K3, MAP2K1, IGFBP3, IGF1, PRKCB, PRKCA, PTK2, CREB3, CREB1, PIK3R1, GNAQ, GNAS, GRB2, ATF4, CREB5, IRS1, IRS2, CSH2, CSH1, CACNA1C, CACNA1D, IRS4, CACNA1F, GHRHR, PRKACG, CACNA1S, PLCG1, PLCG2, JUNB, PRKACB, MAP2K6, PRKACA, STAT5A, SSTR1, SSTR2, SSTR3, GH1, SSTR5, GH2, PIK3CB, PIK3CA, SOS2, BCAR1, SOS1, GSK3B, SHC3, SHC4, SHC1, SHC2, ITPR2, ITPR3, PIK3R3, PIK3R2, ITPR1, SOCS3, GHR, SOCS1, SOCS2, POU1F1, STAT1, STAT3, FOS, MTOR, PLCB4, GHRH, CRK, GHRL, KRAS, PLCB2, PLCB3, PLCB1, PIK3CD, GNAI1, GNAI2, GNAI3, MAPK9, MAPK8, GNA11, EP300, MAPK3, HRAS, MAPK1, JAK2	['MAP3K1', 'MAPK13', 'MAPK14', 'MAPK11', 'MAPK12', 'SST', 'MAPK10', 'ADCY10', 'RAF1', 'ATF2', 'ADCY1', 'IGFALS', 'ATF6B', 'ADCY5', 'ADCY4', 'ADCY3', 'ADCY2', 'ADCY9', 'ADCY8', 'ADCY7', 'ADCY6', 'CRKL', 'CREB3L1', 'NRAS', 'CREB3L4', 'AKT3', 'CREB3L2', 'CREB3L3', 'AKT1', 'AKT2', 'GHSR', 'MAP2K4', 'STAT5B', 'CREBBP', 'PRKCG', 'MAP2K2', 'MAP2K3', 'MAP2K1', 'IGFBP3', 'IGF1', 'PRKCB', 'PRKCA', 'PTK2', 'CREB3', 'CREB1', 'PIK3R1', 'GNAQ', 'GNAS', 'GRB2', 'ATF4', 'CREB5', 'IRS1', 'IRS2', 'CSH2', 'CSH1', 'CACNA1C', 'CACNA1D', 'IRS4', 'CACNA1F', 'GHRHR', 'PRKACG', 'CACNA1S', 'PLCG1', 'PLCG2', 'JUNB', 'PRKACB', 'MAP2K6', 'PRKACA', 'STAT5A', 'SSTR1', 'SSTR2', 'SSTR3', 'GH1', 'SSTR5', 'GH2', 'PIK3CB', 'PIK3CA', 'SOS2', 'BCAR1', 'SOS1', 'GSK3B', 'SHC3', 'SHC4', 'SHC1', 'SHC2', 'ITPR2', 'ITPR3', 'PIK3R3', 'PIK3R2', 'ITPR1', 'SOCS3', 'GHR', 'SOCS1', 'SOCS2', 'POU1F1', 'STAT1', 'STAT3', 'FOS', 'MTOR', 'PLCB4', 'GHRH', 'CRK', 'GHRL', 'KRAS', 'PLCB2', 'PLCB3', 'PLCB1', 'PIK3CD', 'GNAI1', 'GNAI2', 'GNAI3', 'MAPK9', 'MAPK8', 'GNA11', 'EP300', 'MAPK3', 'HRAS', 'MAPK1', 'JAK2']	119	40.831932773109244	0.9831932773109243	0.01680672268907568
Hippo signaling pathway	1	163	TGFB1, TGFB3, TGFB2, FBXW11, TPTEP2-CSNK1E, WNT5A, WNT5B, PPP2R1A, SCRIB, PPP1CA, PPP1CB, APC, DCHS2, DCHS1, AJUBA, LEF1, YAP1, SERPINE1, FZD10, NKD1, AMOT, NKD2, PARD6G, PARD6A, PPP1CC, ACTB, CCND3, PAK1, PARD6B, CCND2, CCND1, CSNK1D, CDH1, MYC, CCN2, BTRC, FZD2, SMAD3, WWTR1, FZD1, SMAD2, FZD4, WNT10B, FZD3, PRKCI, SMAD4, WNT10A, FZD6, WNT3A, FZD5, FZD8, SMAD1, FZD7, FZD9, PARD3, CSNK1E, GDF5, GDF7, SMAD7, FRMD1, GDF6, MOB1A, LATS2, TP73, DLG1, LATS1, MOB1B, DLG2, FRMD6, PRKCZ, DLG3, DLG4, DLG5, BIRC5, SNAI2, TCF7, FAT4, BIRC2, BIRC3, WNT2B, PATJ, WWC1, ACTG1, FGF1, RASSF1, RASSF2, SOX2, RASSF4, RASSF6, TP53BP2, AXIN2, BMP8B, AXIN1, WNT9A, BMP8A, WNT9B, TGFBR1, BMP7, TGFBR2, BMP6, WNT16, BMP5, BMP4, BMP2, ID1, ID2, NF2, BMPR1A, PALS1, BMPR1B, YWHAG, BMPR2, GSK3B, YWHAE, YWHAB, WNT8B, WNT8A, AREG, LIMD1, SAV1, STK3, BBC3, WNT6, WNT11, DVL1, DVL2, YWHAQ, DVL3, AMH, WNT1, TEAD1, WNT2, TEAD2, WNT3, TEAD3, WNT4, YWHAH, TEAD4, TCF7L2, APC2, TCF7L1, WNT7A, WNT7B, WTIP, YWHAZ, PPP2CA, PPP2R2D, PPP2R2C, LLGL1, LLGL2, ITGB2, CRB2, CRB1, CTNNB1, AFP, PPP2R2B, PPP2R2A, GLI2, PPP2CB, PPP2R1B, CTNNA2, CTNNA1, CTNNA3	['TGFB1', 'TGFB3', 'TGFB2', 'FBXW11', 'TPTEP2-CSNK1E', 'WNT5A', 'WNT5B', 'PPP2R1A', 'SCRIB', 'PPP1CA', 'PPP1CB', 'APC', 'DCHS2', 'DCHS1', 'AJUBA', 'LEF1', 'YAP1', 'SERPINE1', 'FZD10', 'NKD1', 'AMOT', 'NKD2', 'PARD6G', 'PARD6A', 'PPP1CC', 'ACTB', 'CCND3', 'PAK1', 'PARD6B', 'CCND2', 'CCND1', 'CSNK1D', 'CDH1', 'MYC', 'CCN2', 'BTRC', 'FZD2', 'SMAD3', 'WWTR1', 'FZD1', 'SMAD2', 'FZD4', 'WNT10B', 'FZD3', 'PRKCI', 'SMAD4', 'WNT10A', 'FZD6', 'WNT3A', 'FZD5', 'FZD8', 'SMAD1', 'FZD7', 'FZD9', 'PARD3', 'CSNK1E', 'GDF5', 'GDF7', 'SMAD7', 'FRMD1', 'GDF6', 'MOB1A', 'LATS2', 'TP73', 'DLG1', 'LATS1', 'MOB1B', 'DLG2', 'FRMD6', 'PRKCZ', 'DLG3', 'DLG4', 'DLG5', 'BIRC5', 'SNAI2', 'TCF7', 'FAT4', 'BIRC2', 'BIRC3', 'WNT2B', 'PATJ', 'WWC1', 'ACTG1', 'FGF1', 'RASSF1', 'RASSF2', 'SOX2', 'RASSF4', 'RASSF6', 'TP53BP2', 'AXIN2', 'BMP8B', 'AXIN1', 'WNT9A', 'BMP8A', 'WNT9B', 'TGFBR1', 'BMP7', 'TGFBR2', 'BMP6', 'WNT16', 'BMP5', 'BMP4', 'BMP2', 'ID1', 'ID2', 'NF2', 'BMPR1A', 'PALS1', 'BMPR1B', 'YWHAG', 'BMPR2', 'GSK3B', 'YWHAE', 'YWHAB', 'WNT8B', 'WNT8A', 'AREG', 'LIMD1', 'SAV1', 'STK3', 'BBC3', 'WNT6', 'WNT11', 'DVL1', 'DVL2', 'YWHAQ', 'DVL3', 'AMH', 'WNT1', 'TEAD1', 'WNT2', 'TEAD2', 'WNT3', 'TEAD3', 'WNT4', 'YWHAH', 'TEAD4', 'TCF7L2', 'APC2', 'TCF7L1', 'WNT7A', 'WNT7B', 'WTIP', 'YWHAZ', 'PPP2CA', 'PPP2R2D', 'PPP2R2C', 'LLGL1', 'LLGL2', 'ITGB2', 'CRB2', 'CRB1', 'CTNNB1', 'AFP', 'PPP2R2B', 'PPP2R2A', 'GLI2', 'PPP2CB', 'PPP2R1B', 'CTNNA2', 'CTNNA1', 'CTNNA3']	163	10.28834355828221	0.8282208588957055	0.17177914110429449
Gap junction	1	88	PDGFRB, EGF, GUCY1A2, PDGFRA, GUCY1A1, MAP3K2, TUBB, TUBB2A, TUBA4A, TUBA8, GJD2, TUBB2B, CDK1, SOS2, RAF1, SOS1, ADCY1, TUBAL3, ADCY5, HTR2C, ITPR2, TUBB1, ADCY4, ADRB1, ITPR3, ADCY3, HTR2A, ADCY2, HTR2B, ADCY9, TUBA3C, ADCY8, EGFR, ADCY7, ADCY6, ITPR1, NRAS, TUBB8, TUBA3E, TUBA3D, TUBB6, CSNK1D, TUBB3, DRD1, DRD2, PRKG2, PRKG1, MAP2K5, PRKCG, MAP2K2, MAP2K1, PRKCB, PRKCA, TUBB4B, TUBB4A, TJP1, PLCB4, GNAQ, GNAS, GRB2, KRAS, PLCB2, PLCB3, PLCB1, SRC, GUCY1B1, PDGFC, PDGFB, PDGFA, TUBA1A, GNAI1, GNAI2, GNAI3, GRM1, LPAR1, PRKACG, TUBA1C, GJA1, GRM5, TUBA1B, GNA11, PDGFD, MAPK3, HRAS, MAPK1, MAPK7, PRKACB, PRKACA	['PDGFRB', 'EGF', 'GUCY1A2', 'PDGFRA', 'GUCY1A1', 'MAP3K2', 'TUBB', 'TUBB2A', 'TUBA4A', 'TUBA8', 'GJD2', 'TUBB2B', 'CDK1', 'SOS2', 'RAF1', 'SOS1', 'ADCY1', 'TUBAL3', 'ADCY5', 'HTR2C', 'ITPR2', 'TUBB1', 'ADCY4', 'ADRB1', 'ITPR3', 'ADCY3', 'HTR2A', 'ADCY2', 'HTR2B', 'ADCY9', 'TUBA3C', 'ADCY8', 'EGFR', 'ADCY7', 'ADCY6', 'ITPR1', 'NRAS', 'TUBB8', 'TUBA3E', 'TUBA3D', 'TUBB6', 'CSNK1D', 'TUBB3', 'DRD1', 'DRD2', 'PRKG2', 'PRKG1', 'MAP2K5', 'PRKCG', 'MAP2K2', 'MAP2K1', 'PRKCB', 'PRKCA', 'TUBB4B', 'TUBB4A', 'TJP1', 'PLCB4', 'GNAQ', 'GNAS', 'GRB2', 'KRAS', 'PLCB2', 'PLCB3', 'PLCB1', 'SRC', 'GUCY1B1', 'PDGFC', 'PDGFB', 'PDGFA', 'TUBA1A', 'GNAI1', 'GNAI2', 'GNAI3', 'GRM1', 'LPAR1', 'PRKACG', 'TUBA1C', 'GJA1', 'GRM5', 'TUBA1B', 'GNA11', 'PDGFD', 'MAPK3', 'HRAS', 'MAPK1', 'MAPK7', 'PRKACB', 'PRKACA']	88	32.67045454545455	0.9886363636363636	0.011363636363636354
Nicotinate and nicotinamide metabolism	1	35	SIRT5, SIRT6, SIRT7, NMNAT3, SIRT1, SIRT2, SIRT3, SIRT4, NT5C1A, BST1, NMNAT2, NMNAT1, NT5C1B, NT5C1B-RDH14, NNMT, QPRT, NADSYN1, NT5C2, NUDT12, PNP, NT5E, NNT, NAMPT, ENPP1, NMRK2, NAPRT, NMRK1, NT5C, AOX1, ENPP3, NT5M, CD38, ASPDH, NADK, NADK2	['SIRT5', 'SIRT6', 'SIRT7', 'NMNAT3', 'SIRT1', 'SIRT2', 'SIRT3', 'SIRT4', 'NT5C1A', 'BST1', 'NMNAT2', 'NMNAT1', 'NT5C1B', 'NT5C1B-RDH14', 'NNMT', 'QPRT', 'NADSYN1', 'NT5C2', 'NUDT12', 'PNP', 'NT5E', 'NNT', 'NAMPT', 'ENPP1', 'NMRK2', 'NAPRT', 'NMRK1', 'NT5C', 'AOX1', 'ENPP3', 'NT5M', 'CD38', 'ASPDH', 'NADK', 'NADK2']	35	2.4857142857142858	0.5142857142857142	0.48571428571428577
Prolactin signaling pathway	1	70	PRLR, MAPK13, GCK, MAPK14, MAPK11, IRF1, MAPK12, MAPK10, TH, PIK3CB, ELF5, PIK3CA, SOS2, RAF1, SOS1, GALT, RELA, GSK3B, SHC3, SHC4, SHC1, TNFRSF11A, SHC2, PRL, PIK3R3, PIK3R2, CSN2, FOXO3, SOCS3, NRAS, SOCS4, SOCS1, SOCS2, CCND2, CCND1, AKT3, AKT1, AKT2, SOCS7, SOCS5, SOCS6, STAT5B, LHCGR, MAP2K2, STAT1, CISH, MAP2K1, STAT3, FOS, ESR1, ESR2, NFKB1, PIK3R1, GRB2, KRAS, SRC, LHB, SLC2A2, PIK3CD, INS, CYP17A1, MAPK9, MAPK8, MAPK3, TNFSF11, HRAS, MAPK1, CGA, JAK2, STAT5A	['PRLR', 'MAPK13', 'GCK', 'MAPK14', 'MAPK11', 'IRF1', 'MAPK12', 'MAPK10', 'TH', 'PIK3CB', 'ELF5', 'PIK3CA', 'SOS2', 'RAF1', 'SOS1', 'GALT', 'RELA', 'GSK3B', 'SHC3', 'SHC4', 'SHC1', 'TNFRSF11A', 'SHC2', 'PRL', 'PIK3R3', 'PIK3R2', 'CSN2', 'FOXO3', 'SOCS3', 'NRAS', 'SOCS4', 'SOCS1', 'SOCS2', 'CCND2', 'CCND1', 'AKT3', 'AKT1', 'AKT2', 'SOCS7', 'SOCS5', 'SOCS6', 'STAT5B', 'LHCGR', 'MAP2K2', 'STAT1', 'CISH', 'MAP2K1', 'STAT3', 'FOS', 'ESR1', 'ESR2', 'NFKB1', 'PIK3R1', 'GRB2', 'KRAS', 'SRC', 'LHB', 'SLC2A2', 'PIK3CD', 'INS', 'CYP17A1', 'MAPK9', 'MAPK8', 'MAPK3', 'TNFSF11', 'HRAS', 'MAPK1', 'CGA', 'JAK2', 'STAT5A']	70	41.02857142857143	0.9714285714285714	0.02857142857142858
Ovarian steroidogenesis	1	51	HSD3B1, FSHB, HSD3B2, BMP6, FSHR, ACOT2, CYP1A1, ACOT1, ACOT4, ADCY1, ADCY5, ADCY4, ADCY3, ADCY2, HSD17B7, ADCY9, ADCY8, ADCY7, BMP15, ADCY6, HSD17B1, HSD17B2, ALOX5, CYP1B1, LDLR, INSR, LHCGR, PLA2G4E, PLA2G4F, PLA2G4C, PLA2G4D, PLA2G4A, AKR1C3, PLA2G4B, IGF1, JMJD7-PLA2G4B, STAR, GNAS, LHB, INS, CYP19A1, IGF1R, PTGS2, CYP17A1, PRKACG, CYP11A1, PRKACB, CGA, SCARB1, CYP2J2, PRKACA	['HSD3B1', 'FSHB', 'HSD3B2', 'BMP6', 'FSHR', 'ACOT2', 'CYP1A1', 'ACOT1', 'ACOT4', 'ADCY1', 'ADCY5', 'ADCY4', 'ADCY3', 'ADCY2', 'HSD17B7', 'ADCY9', 'ADCY8', 'ADCY7', 'BMP15', 'ADCY6', 'HSD17B1', 'HSD17B2', 'ALOX5', 'CYP1B1', 'LDLR', 'INSR', 'LHCGR', 'PLA2G4E', 'PLA2G4F', 'PLA2G4C', 'PLA2G4D', 'PLA2G4A', 'AKR1C3', 'PLA2G4B', 'IGF1', 'JMJD7-PLA2G4B', 'STAR', 'GNAS', 'LHB', 'INS', 'CYP19A1', 'IGF1R', 'PTGS2', 'CYP17A1', 'PRKACG', 'CYP11A1', 'PRKACB', 'CGA', 'SCARB1', 'CYP2J2', 'PRKACA']	51	21.431372549019606	1.0	0.0
Cardiac muscle contraction	1	87	TRDN, TPM4, CACNA2D2, TPM3, CACNA2D1, TPM2, CACNA2D4, CACNA2D3, ATP1B4, ATP1B3, ATP1B2, COX7B2, ATP1B1, COX6C, SLC9A6, SLC9A7, MYL2, MYL3, UQCRQ, FXYD2, MYL4, UQCRC2, HRC, UQCRC1, CYTB, MYH6, MYH7, COX7C, COX7B, COX4I2, UQCR10, ATP1A4, ATP1A3, ATP1A2, UQCR11, ATP1A1, COX6A2, SLC9A1, COX6A1, TPM1, UQCRFS1, COX4I1, COX8A, COX8C, TNNC1, COX7A2L, COX6B1, COX6B2, UQCRHL, CACNB2, CACNB3, CACNB4, TNNT2, ASPH, CASQ2, CACNB1, RYR2, COX5A, UQCRB, CACNA1C, ATP2A3, ATP2A2, ATP2A1, CACNA1D, ACTC1, COX7A1, CACNA1F, COX5B, COX7A2, SLC8A1, SLC8A2, SLC8A3, UQCRH, CACNG7, CACNG8, CACNA1S, COX3, TNNI3, CACNG1, COX2, CACNG2, COX1, CACNG3, CYC1, CACNG4, CACNG5, CACNG6	['TRDN', 'TPM4', 'CACNA2D2', 'TPM3', 'CACNA2D1', 'TPM2', 'CACNA2D4', 'CACNA2D3', 'ATP1B4', 'ATP1B3', 'ATP1B2', 'COX7B2', 'ATP1B1', 'COX6C', 'SLC9A6', 'SLC9A7', 'MYL2', 'MYL3', 'UQCRQ', 'FXYD2', 'MYL4', 'UQCRC2', 'HRC', 'UQCRC1', 'CYTB', 'MYH6', 'MYH7', 'COX7C', 'COX7B', 'COX4I2', 'UQCR10', 'ATP1A4', 'ATP1A3', 'ATP1A2', 'UQCR11', 'ATP1A1', 'COX6A2', 'SLC9A1', 'COX6A1', 'TPM1', 'UQCRFS1', 'COX4I1', 'COX8A', 'COX8C', 'TNNC1', 'COX7A2L', 'COX6B1', 'COX6B2', 'UQCRHL', 'CACNB2', 'CACNB3', 'CACNB4', 'TNNT2', 'ASPH', 'CASQ2', 'CACNB1', 'RYR2', 'COX5A', 'UQCRB', 'CACNA1C', 'ATP2A3', 'ATP2A2', 'ATP2A1', 'CACNA1D', 'ACTC1', 'COX7A1', 'CACNA1F', 'COX5B', 'COX7A2', 'SLC8A1', 'SLC8A2', 'SLC8A3', 'UQCRH', 'CACNG7', 'CACNG8', 'CACNA1S', 'COX3', 'TNNI3', 'CACNG1', 'COX2', 'CACNG2', 'COX1', 'CACNG3', 'CYC1', 'CACNG4', 'CACNG5', 'CACNG6']	87	10.586206896551724	0.9770114942528736	0.02298850574712641
