Pathway	Count	Length	Genes	GeneList	GeneCount	AvgGeneFrequency	SharedGeneFraction	UniqueGeneFraction
Cell cycle	8	124	TGFB1, TGFB3, TGFB2, ZBTB17, CDC25A, CDC25B, RBX1, CDC20, CDC25C, BUB1B, CDC16, MAD2L1, TP53, MAD2L2, PCNA, RB1, CCNH, CDC23, CCND3, FZR1, CCND2, CHEK1, PTTG2, CCND1, CDC26, CDC27, CHEK2, E2F1, MYC, PTTG1, E2F2, E2F3, E2F4, E2F5, SMAD3, CREBBP, SMAD2, SMAD4, PLK1, GADD45B, GADD45A, GADD45G, CCNA2, STAG1, CCNA1, STAG2, TFDP1, TFDP2, MAD1L1, MDM2, ANAPC13, CDC14A, CUL1, PRKDC, PKMYT1, ANAPC10, ANAPC11, CDC14B, SMC3, CCNB3, CCNB2, CCNB1, ABL1, SFN, SKP1, SKP2, CDC7, CDC6, SMC1B, SMC1A, RBL1, CDK7, RBL2, CDK6, ESPL1, CDK4, CDK2, MCM4, ATM, CDK1, MCM5, MCM6, MCM7, ATR, MCM2, MCM3, YWHAG, GSK3B, YWHAE, YWHAB, ORC6, ORC5, RAD21, ORC2, ORC1, ORC4, ORC3, YWHAQ, YWHAH, CDKN2C, CDKN2D, CDKN2A, CDKN2B, YWHAZ, WEE1, WEE2, DBF4, CCNE2, CCNE1, ANAPC4, ANAPC5, ANAPC7, ANAPC1, ANAPC2, CDKN1B, CDKN1C, HDAC1, CDKN1A, HDAC2, TTK, CDC45, EP300, BUB3, BUB1	['TGFB1', 'TGFB3', 'TGFB2', 'ZBTB17', 'CDC25A', 'CDC25B', 'RBX1', 'CDC20', 'CDC25C', 'BUB1B', 'CDC16', 'MAD2L1', 'TP53', 'MAD2L2', 'PCNA', 'RB1', 'CCNH', 'CDC23', 'CCND3', 'FZR1', 'CCND2', 'CHEK1', 'PTTG2', 'CCND1', 'CDC26', 'CDC27', 'CHEK2', 'E2F1', 'MYC', 'PTTG1', 'E2F2', 'E2F3', 'E2F4', 'E2F5', 'SMAD3', 'CREBBP', 'SMAD2', 'SMAD4', 'PLK1', 'GADD45B', 'GADD45A', 'GADD45G', 'CCNA2', 'STAG1', 'CCNA1', 'STAG2', 'TFDP1', 'TFDP2', 'MAD1L1', 'MDM2', 'ANAPC13', 'CDC14A', 'CUL1', 'PRKDC', 'PKMYT1', 'ANAPC10', 'ANAPC11', 'CDC14B', 'SMC3', 'CCNB3', 'CCNB2', 'CCNB1', 'ABL1', 'SFN', 'SKP1', 'SKP2', 'CDC7', 'CDC6', 'SMC1B', 'SMC1A', 'RBL1', 'CDK7', 'RBL2', 'CDK6', 'ESPL1', 'CDK4', 'CDK2', 'MCM4', 'ATM', 'CDK1', 'MCM5', 'MCM6', 'MCM7', 'ATR', 'MCM2', 'MCM3', 'YWHAG', 'GSK3B', 'YWHAE', 'YWHAB', 'ORC6', 'ORC5', 'RAD21', 'ORC2', 'ORC1', 'ORC4', 'ORC3', 'YWHAQ', 'YWHAH', 'CDKN2C', 'CDKN2D', 'CDKN2A', 'CDKN2B', 'YWHAZ', 'WEE1', 'WEE2', 'DBF4', 'CCNE2', 'CCNE1', 'ANAPC4', 'ANAPC5', 'ANAPC7', 'ANAPC1', 'ANAPC2', 'CDKN1B', 'CDKN1C', 'HDAC1', 'CDKN1A', 'HDAC2', 'TTK', 'CDC45', 'EP300', 'BUB3', 'BUB1']	124	9.64516129032258	0.8629032258064516	0.13709677419354838
TGF-beta signaling pathway	3	94	TGFB1, ACVR1, RHOA, TGFB3, TGFB2, SMURF2, SMURF1, BMP8B, PPP2R1A, BMP8A, TGFBR1, ACVR2B, BMP7, RBX1, RGMA, TGFBR2, ACVR2A, BMP6, RGMB, BMP5, BMP4, RBL1, SP1, ZFYVE16, BMP2, BAMBI, ID1, ID3, ID2, IFNG, ID4, NBL1, BMPR1A, BMPR1B, BMPR2, ROCK1, ZFYVE9, TNF, HJV, MYC, E2F4, AMH, E2F5, PITX2, SMAD3, TGIF2, CREBBP, SMAD2, TGIF1, LEFTY2, SMAD5, LEFTY1, SMAD4, NOG, CDKN2B, SMAD1, FST, INHBA, GDF5, INHBC, INHBB, GDF7, INHBE, SMAD7, GDF6, SMAD6, SMAD9, DCN, PPP2CA, GREM2, TFDP1, GREM1, RPS6KB2, RPS6KB1, HAMP, FMOD, NODAL, FBN1, AMHR2, CHRD, CUL1, THBS1, ACVR1C, LTBP1, ACVR1B, MICOS10-NBL1, THSD4, PPP2CB, PPP2R1B, EP300, MAPK3, MAPK1, NEO1, SKP1	['TGFB1', 'ACVR1', 'RHOA', 'TGFB3', 'TGFB2', 'SMURF2', 'SMURF1', 'BMP8B', 'PPP2R1A', 'BMP8A', 'TGFBR1', 'ACVR2B', 'BMP7', 'RBX1', 'RGMA', 'TGFBR2', 'ACVR2A', 'BMP6', 'RGMB', 'BMP5', 'BMP4', 'RBL1', 'SP1', 'ZFYVE16', 'BMP2', 'BAMBI', 'ID1', 'ID3', 'ID2', 'IFNG', 'ID4', 'NBL1', 'BMPR1A', 'BMPR1B', 'BMPR2', 'ROCK1', 'ZFYVE9', 'TNF', 'HJV', 'MYC', 'E2F4', 'AMH', 'E2F5', 'PITX2', 'SMAD3', 'TGIF2', 'CREBBP', 'SMAD2', 'TGIF1', 'LEFTY2', 'SMAD5', 'LEFTY1', 'SMAD4', 'NOG', 'CDKN2B', 'SMAD1', 'FST', 'INHBA', 'GDF5', 'INHBC', 'INHBB', 'GDF7', 'INHBE', 'SMAD7', 'GDF6', 'SMAD6', 'SMAD9', 'DCN', 'PPP2CA', 'GREM2', 'TFDP1', 'GREM1', 'RPS6KB2', 'RPS6KB1', 'HAMP', 'FMOD', 'NODAL', 'FBN1', 'AMHR2', 'CHRD', 'CUL1', 'THBS1', 'ACVR1C', 'LTBP1', 'ACVR1B', 'MICOS10-NBL1', 'THSD4', 'PPP2CB', 'PPP2R1B', 'EP300', 'MAPK3', 'MAPK1', 'NEO1', 'SKP1']	94	10.96808510638298	0.8085106382978723	0.19148936170212771
Cellular senescence	2	156	TGFB1, TGFB3, TGFB2, FBXW11, HUS1, CDC25A, TRPV4, TSC2, TSC1, HIPK2, HIPK1, HIPK4, MAPK13, PPP1CA, HIPK3, MAPK14, PPP1CB, MAPK11, MAPK12, MAPKAPK2, SLC25A31, CALM2, MRE11, SQSTM1, CALM3, TP53, CALM1, PPID, RAF1, RB1, RELA, CALML6, LIN9, SERPINE1, ZFP36L1, CALML3, CALML4, CALML5, FOXO3, FOXO1, ZFP36L2, PPP1CC, NRAS, CCND3, CCND2, CHEK1, CCND1, AKT3, CHEK2, E2F1, MYC, RBBP4, AKT1, E2F2, NBN, AKT2, E2F3, CAPN1, E2F4, CAPN2, E2F5, BTRC, SMAD3, SMAD2, MAP2K2, MAP2K3, GADD45B, MAP2K1, GADD45A, IGFBP3, GADD45G, HLA-C, HLA-A, HLA-B, HLA-G, NFKB1, HLA-E, HLA-F, CCNA2, CCNA1, PIK3R1, RHEB, RAD9A, MDM2, RAD9B, EIF4EBP1, CACNA1D, GATA4, ETS1, FOXM1, CCNB3, PPP3R1, CCNB2, PPP3R2, CCNB1, RASSF5, MYBL2, TRPM7, MAP2K6, NFATC4, NFATC3, NFATC2, NFATC1, SIRT1, TGFBR1, TGFBR2, IL1A, MRAS, RBL1, IL6, RBL2, CDK6, PIK3CB, PIK3CA, CDK4, CDK2, ATM, CDK1, ATR, MCU, CXCL8, SLC25A4, ITPR2, ITPR3, PIK3R3, PIK3R2, KIR2DL4, ITPR1, PPP3CA, PPP3CB, PPP3CC, RRAS2, RRAS, LIN52, LIN54, CDKN2A, CDKN2B, MTOR, RAD50, CCNE2, CCNE1, VDAC3, VDAC2, KRAS, VDAC1, SLC25A6, RAD1, SLC25A5, CDKN1A, LIN37, TRAF3IP2, PTEN, PIK3CD, MAPK3, HRAS, MAPK1	['TGFB1', 'TGFB3', 'TGFB2', 'FBXW11', 'HUS1', 'CDC25A', 'TRPV4', 'TSC2', 'TSC1', 'HIPK2', 'HIPK1', 'HIPK4', 'MAPK13', 'PPP1CA', 'HIPK3', 'MAPK14', 'PPP1CB', 'MAPK11', 'MAPK12', 'MAPKAPK2', 'SLC25A31', 'CALM2', 'MRE11', 'SQSTM1', 'CALM3', 'TP53', 'CALM1', 'PPID', 'RAF1', 'RB1', 'RELA', 'CALML6', 'LIN9', 'SERPINE1', 'ZFP36L1', 'CALML3', 'CALML4', 'CALML5', 'FOXO3', 'FOXO1', 'ZFP36L2', 'PPP1CC', 'NRAS', 'CCND3', 'CCND2', 'CHEK1', 'CCND1', 'AKT3', 'CHEK2', 'E2F1', 'MYC', 'RBBP4', 'AKT1', 'E2F2', 'NBN', 'AKT2', 'E2F3', 'CAPN1', 'E2F4', 'CAPN2', 'E2F5', 'BTRC', 'SMAD3', 'SMAD2', 'MAP2K2', 'MAP2K3', 'GADD45B', 'MAP2K1', 'GADD45A', 'IGFBP3', 'GADD45G', 'HLA-C', 'HLA-A', 'HLA-B', 'HLA-G', 'NFKB1', 'HLA-E', 'HLA-F', 'CCNA2', 'CCNA1', 'PIK3R1', 'RHEB', 'RAD9A', 'MDM2', 'RAD9B', 'EIF4EBP1', 'CACNA1D', 'GATA4', 'ETS1', 'FOXM1', 'CCNB3', 'PPP3R1', 'CCNB2', 'PPP3R2', 'CCNB1', 'RASSF5', 'MYBL2', 'TRPM7', 'MAP2K6', 'NFATC4', 'NFATC3', 'NFATC2', 'NFATC1', 'SIRT1', 'TGFBR1', 'TGFBR2', 'IL1A', 'MRAS', 'RBL1', 'IL6', 'RBL2', 'CDK6', 'PIK3CB', 'PIK3CA', 'CDK4', 'CDK2', 'ATM', 'CDK1', 'ATR', 'MCU', 'CXCL8', 'SLC25A4', 'ITPR2', 'ITPR3', 'PIK3R3', 'PIK3R2', 'KIR2DL4', 'ITPR1', 'PPP3CA', 'PPP3CB', 'PPP3CC', 'RRAS2', 'RRAS', 'LIN52', 'LIN54', 'CDKN2A', 'CDKN2B', 'MTOR', 'RAD50', 'CCNE2', 'CCNE1', 'VDAC3', 'VDAC2', 'KRAS', 'VDAC1', 'SLC25A6', 'RAD1', 'SLC25A5', 'CDKN1A', 'LIN37', 'TRAF3IP2', 'PTEN', 'PIK3CD', 'MAPK3', 'HRAS', 'MAPK1']	156	27.134615384615383	0.8910256410256411	0.10897435897435892
PI3K-Akt signaling pathway	11	354	EGF, BAD, PPP2R1A, EREG, COL1A2, COL1A1, C8ORF44-SGK3, LPAR6, COL9A2, MTCP1, TEK, COL9A1, COL9A3, EPHA2, TP53, ATF2, PRKAA2, IL2RG, PRKAA1, GNG2, CREB3L1, GNG4, GNG3, CREB3L4, MYB, GNG5, AKT3, CREB3L2, FLT3LG, GNG8, CREB3L3, GNG7, MYC, AKT1, AKT2, KDR, NGFR, INSR, IGF1, IGF2, PRKCA, PTK2, COL2A1, PIK3R1, GRB2, ATF4, LPAR2, PDGFC, LPAR3, PDGFB, LPAR4, PDGFA, LPAR5, LPAR1, GNG11, TCL1B, GNG10, TCL1A, CD19, MLST8, PDGFD, VEGFC, FN1, VEGFD, GNG13, GNG12, OSMR, VEGFA, VEGFB, TLR2, KITLG, SGK2, SGK3, TLR4, SGK1, PRL, BRCA1, TGFA, AREG, GNGT2, GNGT1, PCK2, PCK1, SYK, PPP2CA, COL4A1, COL4A3, KIT, CCNE2, COL4A2, CCNE1, COL4A5, COL4A4, PKN1, COL4A6, PKN3, PKN2, IFNA6, IFNA5, CDKN1B, IFNA8, PHLPP1, IFNA7, PHLPP2, IFNA2, CDKN1A, IFNA1, IFNA4, GYS1, PPP2CB, GYS2, IKBKB, RPTOR, HRAS, IFNB1, RAC1, IKBKG, JAK3, JAK1, JAK2, PDGFRB, IL4R, PDGFRA, PRLR, RPS6, IGH, OSM, TSC2, TSC1, ITGA10, ITGA11, RAF1, RELA, CHRM1, CSF3R, EPO, CHRM2, CSF3, TNXB, ATF6B, CRTC2, CSF1, ITGA2B, TNC, EFNA5, EGFR, FOXO3, HSP90B1, COMP, NRAS, BCL2L11, RELN, RXRA, TNN, CCND3, CCND2, CCND1, NTF3, TNR, NTF4, FGF21, FGF20, SPP1, FGF23, FGF22, IFNA13, IFNA14, MAP2K2, F2R, IFNA16, IFNA17, MAP2K1, HGF, NFKB1, PGF, CREB3, EFNA2, FGF18, EFNA1, EIF4E1B, FGF17, CREB1, EFNA4, FGF16, EFNA3, COL6A1, GNB1, RHEB, COL6A3, GNB3, COL6A2, FGF19, GNB2, BCL2L1, COL6A5, FGF10, FGFR1, GNB5, GNB4, COL6A6, FGFR4, CREB5, FGFR3, IFNA10, IFNAR1, FGFR2, IFNAR2, IL7R, MDM2, CSF1R, IRS1, CSH2, CSH1, EIF4EBP1, FASLG, FGF1, FGF2, FGF3, FGF4, IGF1R, NR4A1, VTN, FGF5, FGF6, FGF7, STK11, FGF8, FGF9, THEM4, IBSP, CHAD, IL6R, IFNA21, ITGA1, ANGPT4, HSP90AA1, ANGPT2, ITGA5, LAMB4, ANGPT1, ITGA4, LAMB3, BDNF, ITGA3, ITGA2, PPP2R5C, PPP2R5B, LAMB2, PPP2R5E, LAMB1, PPP2R5D, G6PC1, G6PC2, GH1, IL3, PPP2R5A, IL2, GH2, IL4, G6PC3, IL7, IL6, RBL2, CDK6, PIK3CB, PIK3CA, CDK4, IL3RA, CDK2, ITGA9, BCL2, ITGA8, ITGA7, ITGA6, SOS2, EIF4E2, SOS1, EIF4B, YWHAG, GSK3B, YWHAE, YWHAB, LAMC1, PIK3R5, LAMC3, PIK3R3, LAMC2, PIK3R2, PIK3R6, GHR, CASP9, ERBB4, ERBB2, ERBB3, YWHAQ, EIF4E, MCL1, YWHAH, MAGI2, NTRK2, MAGI1, NTRK1, NOS3, CHUK, VWF, PDPK1, PPP2R3A, PPP2R3C, PPP2R3B, YWHAZ, EPOR, MTOR, NGF, PPP2R2D, RPS6KB2, CDC37, IL2RA, PPP2R2C, RPS6KB1, DDIT4, IL2RB, MET, KRAS, PIK3AP1, ITGB1, FLT1, FLT3, HSP90AB1, ITGB6, LAMA3, FLT4, ITGB5, LAMA2, ITGB4, LAMA5, ITGB3, LAMA4, PTEN, LAMA1, PIK3CD, PPP2R2B, THBS1, PPP2R2A, INS, THBS3, THBS2, PIK3CG, THBS4, PPP2R1B, MAPK3, ITGB8, MAPK1, ITGAV, ITGB7	['EGF', 'BAD', 'PPP2R1A', 'EREG', 'COL1A2', 'COL1A1', 'C8ORF44-SGK3', 'LPAR6', 'COL9A2', 'MTCP1', 'TEK', 'COL9A1', 'COL9A3', 'EPHA2', 'TP53', 'ATF2', 'PRKAA2', 'IL2RG', 'PRKAA1', 'GNG2', 'CREB3L1', 'GNG4', 'GNG3', 'CREB3L4', 'MYB', 'GNG5', 'AKT3', 'CREB3L2', 'FLT3LG', 'GNG8', 'CREB3L3', 'GNG7', 'MYC', 'AKT1', 'AKT2', 'KDR', 'NGFR', 'INSR', 'IGF1', 'IGF2', 'PRKCA', 'PTK2', 'COL2A1', 'PIK3R1', 'GRB2', 'ATF4', 'LPAR2', 'PDGFC', 'LPAR3', 'PDGFB', 'LPAR4', 'PDGFA', 'LPAR5', 'LPAR1', 'GNG11', 'TCL1B', 'GNG10', 'TCL1A', 'CD19', 'MLST8', 'PDGFD', 'VEGFC', 'FN1', 'VEGFD', 'GNG13', 'GNG12', 'OSMR', 'VEGFA', 'VEGFB', 'TLR2', 'KITLG', 'SGK2', 'SGK3', 'TLR4', 'SGK1', 'PRL', 'BRCA1', 'TGFA', 'AREG', 'GNGT2', 'GNGT1', 'PCK2', 'PCK1', 'SYK', 'PPP2CA', 'COL4A1', 'COL4A3', 'KIT', 'CCNE2', 'COL4A2', 'CCNE1', 'COL4A5', 'COL4A4', 'PKN1', 'COL4A6', 'PKN3', 'PKN2', 'IFNA6', 'IFNA5', 'CDKN1B', 'IFNA8', 'PHLPP1', 'IFNA7', 'PHLPP2', 'IFNA2', 'CDKN1A', 'IFNA1', 'IFNA4', 'GYS1', 'PPP2CB', 'GYS2', 'IKBKB', 'RPTOR', 'HRAS', 'IFNB1', 'RAC1', 'IKBKG', 'JAK3', 'JAK1', 'JAK2', 'PDGFRB', 'IL4R', 'PDGFRA', 'PRLR', 'RPS6', 'IGH', 'OSM', 'TSC2', 'TSC1', 'ITGA10', 'ITGA11', 'RAF1', 'RELA', 'CHRM1', 'CSF3R', 'EPO', 'CHRM2', 'CSF3', 'TNXB', 'ATF6B', 'CRTC2', 'CSF1', 'ITGA2B', 'TNC', 'EFNA5', 'EGFR', 'FOXO3', 'HSP90B1', 'COMP', 'NRAS', 'BCL2L11', 'RELN', 'RXRA', 'TNN', 'CCND3', 'CCND2', 'CCND1', 'NTF3', 'TNR', 'NTF4', 'FGF21', 'FGF20', 'SPP1', 'FGF23', 'FGF22', 'IFNA13', 'IFNA14', 'MAP2K2', 'F2R', 'IFNA16', 'IFNA17', 'MAP2K1', 'HGF', 'NFKB1', 'PGF', 'CREB3', 'EFNA2', 'FGF18', 'EFNA1', 'EIF4E1B', 'FGF17', 'CREB1', 'EFNA4', 'FGF16', 'EFNA3', 'COL6A1', 'GNB1', 'RHEB', 'COL6A3', 'GNB3', 'COL6A2', 'FGF19', 'GNB2', 'BCL2L1', 'COL6A5', 'FGF10', 'FGFR1', 'GNB5', 'GNB4', 'COL6A6', 'FGFR4', 'CREB5', 'FGFR3', 'IFNA10', 'IFNAR1', 'FGFR2', 'IFNAR2', 'IL7R', 'MDM2', 'CSF1R', 'IRS1', 'CSH2', 'CSH1', 'EIF4EBP1', 'FASLG', 'FGF1', 'FGF2', 'FGF3', 'FGF4', 'IGF1R', 'NR4A1', 'VTN', 'FGF5', 'FGF6', 'FGF7', 'STK11', 'FGF8', 'FGF9', 'THEM4', 'IBSP', 'CHAD', 'IL6R', 'IFNA21', 'ITGA1', 'ANGPT4', 'HSP90AA1', 'ANGPT2', 'ITGA5', 'LAMB4', 'ANGPT1', 'ITGA4', 'LAMB3', 'BDNF', 'ITGA3', 'ITGA2', 'PPP2R5C', 'PPP2R5B', 'LAMB2', 'PPP2R5E', 'LAMB1', 'PPP2R5D', 'G6PC1', 'G6PC2', 'GH1', 'IL3', 'PPP2R5A', 'IL2', 'GH2', 'IL4', 'G6PC3', 'IL7', 'IL6', 'RBL2', 'CDK6', 'PIK3CB', 'PIK3CA', 'CDK4', 'IL3RA', 'CDK2', 'ITGA9', 'BCL2', 'ITGA8', 'ITGA7', 'ITGA6', 'SOS2', 'EIF4E2', 'SOS1', 'EIF4B', 'YWHAG', 'GSK3B', 'YWHAE', 'YWHAB', 'LAMC1', 'PIK3R5', 'LAMC3', 'PIK3R3', 'LAMC2', 'PIK3R2', 'PIK3R6', 'GHR', 'CASP9', 'ERBB4', 'ERBB2', 'ERBB3', 'YWHAQ', 'EIF4E', 'MCL1', 'YWHAH', 'MAGI2', 'NTRK2', 'MAGI1', 'NTRK1', 'NOS3', 'CHUK', 'VWF', 'PDPK1', 'PPP2R3A', 'PPP2R3C', 'PPP2R3B', 'YWHAZ', 'EPOR', 'MTOR', 'NGF', 'PPP2R2D', 'RPS6KB2', 'CDC37', 'IL2RA', 'PPP2R2C', 'RPS6KB1', 'DDIT4', 'IL2RB', 'MET', 'KRAS', 'PIK3AP1', 'ITGB1', 'FLT1', 'FLT3', 'HSP90AB1', 'ITGB6', 'LAMA3', 'FLT4', 'ITGB5', 'LAMA2', 'ITGB4', 'LAMA5', 'ITGB3', 'LAMA4', 'PTEN', 'LAMA1', 'PIK3CD', 'PPP2R2B', 'THBS1', 'PPP2R2A', 'INS', 'THBS3', 'THBS2', 'PIK3CG', 'THBS4', 'PPP2R1B', 'MAPK3', 'ITGB8', 'MAPK1', 'ITGAV', 'ITGB7']	354	18.1864406779661	0.9774011299435028	0.02259887005649719
Calcium signaling pathway	15	240	TRHR, EGF, GRIN2D, GRIN2C, HTR5A, ORAI3, AGTR1, ORAI2, PLCD1, ORAI1, CALM2, PLCD4, CALM3, CALM1, PLCD3, ADCY1, CALML6, ADCY4, CALML3, ADCY3, CALML4, MST1R, ADCY2, CALML5, ADCY9, ADCY8, ADCY7, PLCE1, KDR, NTSR1, PRKCG, TNNC1, TNNC2, AVPR1A, PHKA2, PRKCB, AVPR1B, PHKA1, PRKCA, CCKBR, PTGFR, OXTR, PDE1C, PDE1B, PDE1A, PDGFC, PDGFB, PDGFA, GRPR, HTR6, MYLK, HTR4, PPP3R1, PRKACG, HTR7, PPP3R2, GRIN2A, PDGFD, PLCG1, PLCG2, PRKACB, PRKACA, MST1, SPHK2, SPHK1, TACR3, VEGFC, VEGFD, TACR1, TACR2, VEGFA, VEGFB, ITPKC, ITPKA, ITPKB, CAMK4, HRC, CAMK1, RET, ADRB1, ADRB2, ADRB3, PPP3CA, PPP3CB, PPP3CC, CCKAR, CD38, PLCB4, PLCB2, PLCB3, PLCB1, RYR2, RYR3, RYR1, PTGER1, PTAFR, PTGER3, SLC8A1, SLC8A2, SLC8A3, CXCR4, PDGFRB, PDGFRA, IGH, GRIN1, STIM1, STIM2, LTB4R2, SLC25A31, PPIF, CHRM3, CHRM1, CHRM2, CHRM5, CHRNA7, EGFR, CYSLTR2, CYSLTR1, FGF21, FGF20, FGF23, FGF22, F2R, HGF, PHKB, FGF18, GNAL, FGF17, FGF16, GDNF, FGF19, GNAQ, FGF10, FGFR1, GNAS, CASQ1, CASQ2, FGFR4, FGFR3, FGFR2, CACNA1A, CACNA1C, CACNA1B, CACNA1E, CACNA1D, FGF1, CACNA1G, FGF2, CACNA1F, FGF3, CACNA1I, FGF4, CACNA1H, FGF5, FGF6, FGF7, FGF8, FGF9, CACNA1S, TRDN, TPCN1, TPCN2, ADORA2B, ADORA2A, MCU, SLC25A4, HTR2C, ITPR2, ITPR3, HTR2A, ADRA1D, HTR2B, ADRA1B, ADRA1A, ITPR1, HRH2, HRH1, ERBB4, TBXA2R, BDKRB1, ERBB2, ERBB3, PLCZ1, BDKRB2, DRD1, DRD5, NTRK2, LHCGR, NTRK3, CAMK1D, NTRK1, NOS3, ATP2B4, ATP2B3, ATP2B2, ATP2B1, MCOLN2, MCOLN3, NGF, MCOLN1, P2RX7, P2RX6, P2RX5, P2RX4, P2RX3, P2RX2, ASPH, P2RX1, VDAC3, MET, VDAC2, VDAC1, SLC25A6, CAMK1G, SLC25A5, MYLK2, CAMK2D, MYLK3, FLT1, FLT4, CAMK2A, CAMK2B, ATP2A3, ATP2A2, ATP2A1, MYLK4, GRM1, GNA14, PLN, EDNRA, GNA15, EDNRB, GRM5, PHKG2, GNA11, PHKG1, PTK2B, NOS1, NOS2, CAMK2G	['TRHR', 'EGF', 'GRIN2D', 'GRIN2C', 'HTR5A', 'ORAI3', 'AGTR1', 'ORAI2', 'PLCD1', 'ORAI1', 'CALM2', 'PLCD4', 'CALM3', 'CALM1', 'PLCD3', 'ADCY1', 'CALML6', 'ADCY4', 'CALML3', 'ADCY3', 'CALML4', 'MST1R', 'ADCY2', 'CALML5', 'ADCY9', 'ADCY8', 'ADCY7', 'PLCE1', 'KDR', 'NTSR1', 'PRKCG', 'TNNC1', 'TNNC2', 'AVPR1A', 'PHKA2', 'PRKCB', 'AVPR1B', 'PHKA1', 'PRKCA', 'CCKBR', 'PTGFR', 'OXTR', 'PDE1C', 'PDE1B', 'PDE1A', 'PDGFC', 'PDGFB', 'PDGFA', 'GRPR', 'HTR6', 'MYLK', 'HTR4', 'PPP3R1', 'PRKACG', 'HTR7', 'PPP3R2', 'GRIN2A', 'PDGFD', 'PLCG1', 'PLCG2', 'PRKACB', 'PRKACA', 'MST1', 'SPHK2', 'SPHK1', 'TACR3', 'VEGFC', 'VEGFD', 'TACR1', 'TACR2', 'VEGFA', 'VEGFB', 'ITPKC', 'ITPKA', 'ITPKB', 'CAMK4', 'HRC', 'CAMK1', 'RET', 'ADRB1', 'ADRB2', 'ADRB3', 'PPP3CA', 'PPP3CB', 'PPP3CC', 'CCKAR', 'CD38', 'PLCB4', 'PLCB2', 'PLCB3', 'PLCB1', 'RYR2', 'RYR3', 'RYR1', 'PTGER1', 'PTAFR', 'PTGER3', 'SLC8A1', 'SLC8A2', 'SLC8A3', 'CXCR4', 'PDGFRB', 'PDGFRA', 'IGH', 'GRIN1', 'STIM1', 'STIM2', 'LTB4R2', 'SLC25A31', 'PPIF', 'CHRM3', 'CHRM1', 'CHRM2', 'CHRM5', 'CHRNA7', 'EGFR', 'CYSLTR2', 'CYSLTR1', 'FGF21', 'FGF20', 'FGF23', 'FGF22', 'F2R', 'HGF', 'PHKB', 'FGF18', 'GNAL', 'FGF17', 'FGF16', 'GDNF', 'FGF19', 'GNAQ', 'FGF10', 'FGFR1', 'GNAS', 'CASQ1', 'CASQ2', 'FGFR4', 'FGFR3', 'FGFR2', 'CACNA1A', 'CACNA1C', 'CACNA1B', 'CACNA1E', 'CACNA1D', 'FGF1', 'CACNA1G', 'FGF2', 'CACNA1F', 'FGF3', 'CACNA1I', 'FGF4', 'CACNA1H', 'FGF5', 'FGF6', 'FGF7', 'FGF8', 'FGF9', 'CACNA1S', 'TRDN', 'TPCN1', 'TPCN2', 'ADORA2B', 'ADORA2A', 'MCU', 'SLC25A4', 'HTR2C', 'ITPR2', 'ITPR3', 'HTR2A', 'ADRA1D', 'HTR2B', 'ADRA1B', 'ADRA1A', 'ITPR1', 'HRH2', 'HRH1', 'ERBB4', 'TBXA2R', 'BDKRB1', 'ERBB2', 'ERBB3', 'PLCZ1', 'BDKRB2', 'DRD1', 'DRD5', 'NTRK2', 'LHCGR', 'NTRK3', 'CAMK1D', 'NTRK1', 'NOS3', 'ATP2B4', 'ATP2B3', 'ATP2B2', 'ATP2B1', 'MCOLN2', 'MCOLN3', 'NGF', 'MCOLN1', 'P2RX7', 'P2RX6', 'P2RX5', 'P2RX4', 'P2RX3', 'P2RX2', 'ASPH', 'P2RX1', 'VDAC3', 'MET', 'VDAC2', 'VDAC1', 'SLC25A6', 'CAMK1G', 'SLC25A5', 'MYLK2', 'CAMK2D', 'MYLK3', 'FLT1', 'FLT4', 'CAMK2A', 'CAMK2B', 'ATP2A3', 'ATP2A2', 'ATP2A1', 'MYLK4', 'GRM1', 'GNA14', 'PLN', 'EDNRA', 'GNA15', 'EDNRB', 'GRM5', 'PHKG2', 'GNA11', 'PHKG1', 'PTK2B', 'NOS1', 'NOS2', 'CAMK2G']	240	15.245833333333334	0.9541666666666667	0.04583333333333328
Glycolysis / Gluconeogenesis	6	67	PDHA2, PDHA1, TPI1, AKR1A1, G6PC1, G6PC2, GCK, G6PC3, GAPDHS, ALDOC, ALDOB, FBP1, ALDOA, FBP2, GPI, ADH1C, ADH1B, ADH1A, PDHB, HK1, HK3, HK2, LDHC, LDHB, LDHA, PGK2, PGK1, ACSS2, PCK2, ACSS1, PCK1, PGAM1, PKLR, PGAM2, BPGM, MINPP1, PKM, ALDH3A2, ALDH7A1, PFKM, PFKL, ALDH3A1, HKDC1, PGAM4, DLD, GALM, ALDH9A1, LDHAL6A, GAPDH, LDHAL6B, PFKP, ADPGK, ENO1, ENO2, ENO3, ENO4, ADH6, ADH7, ADH4, ADH5, ALDH1B1, ALDH2, ALDH3B2, ALDH3B1, DLAT, PGM2, PGM1	['PDHA2', 'PDHA1', 'TPI1', 'AKR1A1', 'G6PC1', 'G6PC2', 'GCK', 'G6PC3', 'GAPDHS', 'ALDOC', 'ALDOB', 'FBP1', 'ALDOA', 'FBP2', 'GPI', 'ADH1C', 'ADH1B', 'ADH1A', 'PDHB', 'HK1', 'HK3', 'HK2', 'LDHC', 'LDHB', 'LDHA', 'PGK2', 'PGK1', 'ACSS2', 'PCK2', 'ACSS1', 'PCK1', 'PGAM1', 'PKLR', 'PGAM2', 'BPGM', 'MINPP1', 'PKM', 'ALDH3A2', 'ALDH7A1', 'PFKM', 'PFKL', 'ALDH3A1', 'HKDC1', 'PGAM4', 'DLD', 'GALM', 'ALDH9A1', 'LDHAL6A', 'GAPDH', 'LDHAL6B', 'PFKP', 'ADPGK', 'ENO1', 'ENO2', 'ENO3', 'ENO4', 'ADH6', 'ADH7', 'ADH4', 'ADH5', 'ALDH1B1', 'ALDH2', 'ALDH3B2', 'ALDH3B1', 'DLAT', 'PGM2', 'PGM1']	67	6.82089552238806	0.9701492537313433	0.02985074626865669
Notch signaling pathway	2	59	PSENEN, TLE4, TLE3, TLE2, TLE1, DTX3L, TLE7, TLE6, KAT2B, KAT2A, NCOR2, MFNG, NUMB, RBPJL, MAML3, MAML2, MAML1, DTX1, DTX2, DTX3, RFNG, DTX4, DLL1, DLL3, DLL4, APH1B, ATXN1L, APH1A, DVL1, DVL2, DVL3, CIR1, HES1, ATXN1, NCSTN, NUMBL, HES5, CREBBP, JAG1, JAG2, PTCRA, HEYL, SNW1, ADAM17, NOTCH3, NOTCH4, NOTCH1, NOTCH2, HDAC1, CTBP2, HDAC2, CTBP1, PSEN1, PSEN2, RBPJ, LFNG, HEY2, HEY1, EP300	['PSENEN', 'TLE4', 'TLE3', 'TLE2', 'TLE1', 'DTX3L', 'TLE7', 'TLE6', 'KAT2B', 'KAT2A', 'NCOR2', 'MFNG', 'NUMB', 'RBPJL', 'MAML3', 'MAML2', 'MAML1', 'DTX1', 'DTX2', 'DTX3', 'RFNG', 'DTX4', 'DLL1', 'DLL3', 'DLL4', 'APH1B', 'ATXN1L', 'APH1A', 'DVL1', 'DVL2', 'DVL3', 'CIR1', 'HES1', 'ATXN1', 'NCSTN', 'NUMBL', 'HES5', 'CREBBP', 'JAG1', 'JAG2', 'PTCRA', 'HEYL', 'SNW1', 'ADAM17', 'NOTCH3', 'NOTCH4', 'NOTCH1', 'NOTCH2', 'HDAC1', 'CTBP2', 'HDAC2', 'CTBP1', 'PSEN1', 'PSEN2', 'RBPJ', 'LFNG', 'HEY2', 'HEY1', 'EP300']	59	5.254237288135593	0.8813559322033898	0.11864406779661019
Wnt signaling pathway	9	166	RNF43, TLE4, RYK, TLE3, TLE2, FBXW11, TLE1, CTNNBIP1, TPTEP2-CSNK1E, WNT5A, WNT5B, DKK1, DKK2, RBX1, TLE7, DKK4, TLE6, SFRP4, SFRP5, SFRP2, TBL1XR1, APC, MAPK10, BAMBI, ROR2, ROR1, TP53, LEF1, ROCK2, CTNND2, LRP6, LRP5, FZD10, NKD1, SFRP1, NKD2, RUVBL1, FRAT1, FRAT2, CCND3, CCND2, WIF1, CCND1, MYC, GPC4, SERPINF1, CCN4, TBL1X, TBL1Y, MAP3K7, BTRC, CER1, FZD2, SIAH1, SMAD3, CREBBP, FZD1, PRKCG, FZD4, WNT10B, FZD3, SMAD4, WNT10A, FZD6, WNT3A, FZD5, FZD8, FZD7, FZD9, CSNK1E, PRKCB, PRKCA, VANGL2, FOSL1, VANGL1, CSNK2B, TCF7, WNT2B, CTBP2, CTBP1, CUL1, PSEN1, NLK, PORCN, PPP3R1, PRKACG, PPP3R2, SOX17, PRKACB, SKP1, PRKACA, RHOA, CSNK1A1, MMP7, JUN, AXIN2, NFATC4, AXIN1, NFATC3, NFATC2, WNT9A, NFATC1, WNT9B, SENP2, WNT16, GSK3B, CHD8, WNT8B, CBY1, WNT8A, PPP3CA, WNT6, PPP3CB, PPP3CC, WNT11, DVL1, DVL2, DVL3, WNT1, WNT2, WNT3, WNT4, TCF7L2, APC2, TCF7L1, CSNK2A2, CSNK2A1, CSNK2A3, WNT7A, CACYBP, WNT7B, CSNK1A1L, PLCB4, DAAM2, NOTUM, DAAM1, PLCB2, LGR6, PLCB3, LGR5, PPARD, LGR4, PLCB1, CAMK2D, INVS, CAMK2A, CTNNB1, CAMK2B, PRICKLE3, PRICKLE4, CXXC4, PRICKLE1, PRICKLE2, MAPK9, ZNRF3, MAPK8, EP300, RAC3, RSPO3, RSPO4, RAC1, RSPO1, SOST, RAC2, RSPO2, CAMK2G	['RNF43', 'TLE4', 'RYK', 'TLE3', 'TLE2', 'FBXW11', 'TLE1', 'CTNNBIP1', 'TPTEP2-CSNK1E', 'WNT5A', 'WNT5B', 'DKK1', 'DKK2', 'RBX1', 'TLE7', 'DKK4', 'TLE6', 'SFRP4', 'SFRP5', 'SFRP2', 'TBL1XR1', 'APC', 'MAPK10', 'BAMBI', 'ROR2', 'ROR1', 'TP53', 'LEF1', 'ROCK2', 'CTNND2', 'LRP6', 'LRP5', 'FZD10', 'NKD1', 'SFRP1', 'NKD2', 'RUVBL1', 'FRAT1', 'FRAT2', 'CCND3', 'CCND2', 'WIF1', 'CCND1', 'MYC', 'GPC4', 'SERPINF1', 'CCN4', 'TBL1X', 'TBL1Y', 'MAP3K7', 'BTRC', 'CER1', 'FZD2', 'SIAH1', 'SMAD3', 'CREBBP', 'FZD1', 'PRKCG', 'FZD4', 'WNT10B', 'FZD3', 'SMAD4', 'WNT10A', 'FZD6', 'WNT3A', 'FZD5', 'FZD8', 'FZD7', 'FZD9', 'CSNK1E', 'PRKCB', 'PRKCA', 'VANGL2', 'FOSL1', 'VANGL1', 'CSNK2B', 'TCF7', 'WNT2B', 'CTBP2', 'CTBP1', 'CUL1', 'PSEN1', 'NLK', 'PORCN', 'PPP3R1', 'PRKACG', 'PPP3R2', 'SOX17', 'PRKACB', 'SKP1', 'PRKACA', 'RHOA', 'CSNK1A1', 'MMP7', 'JUN', 'AXIN2', 'NFATC4', 'AXIN1', 'NFATC3', 'NFATC2', 'WNT9A', 'NFATC1', 'WNT9B', 'SENP2', 'WNT16', 'GSK3B', 'CHD8', 'WNT8B', 'CBY1', 'WNT8A', 'PPP3CA', 'WNT6', 'PPP3CB', 'PPP3CC', 'WNT11', 'DVL1', 'DVL2', 'DVL3', 'WNT1', 'WNT2', 'WNT3', 'WNT4', 'TCF7L2', 'APC2', 'TCF7L1', 'CSNK2A2', 'CSNK2A1', 'CSNK2A3', 'WNT7A', 'CACYBP', 'WNT7B', 'CSNK1A1L', 'PLCB4', 'DAAM2', 'NOTUM', 'DAAM1', 'PLCB2', 'LGR6', 'PLCB3', 'LGR5', 'PPARD', 'LGR4', 'PLCB1', 'CAMK2D', 'INVS', 'CAMK2A', 'CTNNB1', 'CAMK2B', 'PRICKLE3', 'PRICKLE4', 'CXXC4', 'PRICKLE1', 'PRICKLE2', 'MAPK9', 'ZNRF3', 'MAPK8', 'EP300', 'RAC3', 'RSPO3', 'RSPO4', 'RAC1', 'RSPO1', 'SOST', 'RAC2', 'RSPO2', 'CAMK2G']	166	16.19277108433735	0.7469879518072289	0.2530120481927711
Fc epsilon RI signaling pathway	1	68	LYN, IL13, GAB2, IGH, VAV1, IL3, MAPK13, VAV2, MAPK14, VAV3, IL5, MAPK11, IL4, MAPK12, MAPK10, PIK3CB, PIK3CA, LCP2, SOS2, MS4A2, LAT, RAF1, SOS1, CSF2, PIK3R3, TNF, PIK3R2, NRAS, AKT3, ALOX5, AKT1, AKT2, FCER1A, FCER1G, MAP2K4, MAP2K2, MAP2K3, PLA2G4E, MAP2K1, PLA2G4F, SYK, PDPK1, PLA2G4C, PLA2G4D, ALOX5AP, PLA2G4A, PLA2G4B, PRKCA, PIK3R1, JMJD7-PLA2G4B, BTK, GRB2, KRAS, PIK3CD, INPP5D, MAPK9, MAPK8, MAPK3, RAC3, HRAS, MAPK1, PLCG1, RAC1, FYN, PLCG2, RAC2, MAP2K6, MAP2K7	['LYN', 'IL13', 'GAB2', 'IGH', 'VAV1', 'IL3', 'MAPK13', 'VAV2', 'MAPK14', 'VAV3', 'IL5', 'MAPK11', 'IL4', 'MAPK12', 'MAPK10', 'PIK3CB', 'PIK3CA', 'LCP2', 'SOS2', 'MS4A2', 'LAT', 'RAF1', 'SOS1', 'CSF2', 'PIK3R3', 'TNF', 'PIK3R2', 'NRAS', 'AKT3', 'ALOX5', 'AKT1', 'AKT2', 'FCER1A', 'FCER1G', 'MAP2K4', 'MAP2K2', 'MAP2K3', 'PLA2G4E', 'MAP2K1', 'PLA2G4F', 'SYK', 'PDPK1', 'PLA2G4C', 'PLA2G4D', 'ALOX5AP', 'PLA2G4A', 'PLA2G4B', 'PRKCA', 'PIK3R1', 'JMJD7-PLA2G4B', 'BTK', 'GRB2', 'KRAS', 'PIK3CD', 'INPP5D', 'MAPK9', 'MAPK8', 'MAPK3', 'RAC3', 'HRAS', 'MAPK1', 'PLCG1', 'RAC1', 'FYN', 'PLCG2', 'RAC2', 'MAP2K6', 'MAP2K7']	68	43.794117647058826	0.9852941176470589	0.014705882352941124
Th1 and Th2 cell differentiation	2	92	IL4R, JUN, IL13, NFATC3, NFATC2, NFATC1, TYK2, MAPK13, RUNX3, IL2, MAPK14, IL5, MAPK11, NFKBIB, IL4, MAPK12, NFKBIA, CD4, MAPK10, IFNG, HLA-DQB1, HLA-DRA, CD247, NFKBIE, LAT, RELA, RBPJL, MAML3, MAML2, MAML1, CD3G, IL2RG, DLL1, CD3E, CD3D, DLL3, DLL4, PPP3CA, PPP3CB, PPP3CC, TBX21, STAT6, HLA-DOB, IL12RB2, IL12RB1, HLA-DQA2, HLA-DOA, HLA-DQA1, STAT5B, JAG1, HLA-DRB5, JAG2, IFNGR1, STAT1, CHUK, IFNGR2, STAT4, FOS, NFKB1, MAF, LCK, ZAP70, IL2RA, IL2RB, HLA-DPB1, PRKCQ, HLA-DRB4, HLA-DRB3, HLA-DRB1, NOTCH3, NOTCH1, NOTCH2, GATA3, RBPJ, IKBKB, PPP3R1, HLA-DMB, MAPK9, PPP3R2, MAPK8, HLA-DPA1, MAPK3, IL12B, MAPK1, PLCG1, IL12A, IKBKG, JAK3, HLA-DMA, JAK1, JAK2, STAT5A	['IL4R', 'JUN', 'IL13', 'NFATC3', 'NFATC2', 'NFATC1', 'TYK2', 'MAPK13', 'RUNX3', 'IL2', 'MAPK14', 'IL5', 'MAPK11', 'NFKBIB', 'IL4', 'MAPK12', 'NFKBIA', 'CD4', 'MAPK10', 'IFNG', 'HLA-DQB1', 'HLA-DRA', 'CD247', 'NFKBIE', 'LAT', 'RELA', 'RBPJL', 'MAML3', 'MAML2', 'MAML1', 'CD3G', 'IL2RG', 'DLL1', 'CD3E', 'CD3D', 'DLL3', 'DLL4', 'PPP3CA', 'PPP3CB', 'PPP3CC', 'TBX21', 'STAT6', 'HLA-DOB', 'IL12RB2', 'IL12RB1', 'HLA-DQA2', 'HLA-DOA', 'HLA-DQA1', 'STAT5B', 'JAG1', 'HLA-DRB5', 'JAG2', 'IFNGR1', 'STAT1', 'CHUK', 'IFNGR2', 'STAT4', 'FOS', 'NFKB1', 'MAF', 'LCK', 'ZAP70', 'IL2RA', 'IL2RB', 'HLA-DPB1', 'PRKCQ', 'HLA-DRB4', 'HLA-DRB3', 'HLA-DRB1', 'NOTCH3', 'NOTCH1', 'NOTCH2', 'GATA3', 'RBPJ', 'IKBKB', 'PPP3R1', 'HLA-DMB', 'MAPK9', 'PPP3R2', 'MAPK8', 'HLA-DPA1', 'MAPK3', 'IL12B', 'MAPK1', 'PLCG1', 'IL12A', 'IKBKG', 'JAK3', 'HLA-DMA', 'JAK1', 'JAK2', 'STAT5A']	92	25.054347826086957	1.0	0.0
IL-17 signaling pathway	1	94	USP25, HSP90AA1, JUN, MMP1, CCL20, IL13, MMP3, MUC5AC, MAPK15, MMP9, MAPK13, MAPK14, CXCL10, IL5, MAPK11, MMP13, IL1B, IL4, MAPK12, NFKBIA, IL6, MAPK10, IFNG, S100A7, DEFB4B, S100A9, DEFB4A, S100A8, CXCL8, RELA, GSK3B, CSF3, CSF2, SRSF1, TRADD, TNFAIP3, CXCL2, TNF, CXCL1, ELAVL1, CXCL3, CXCL6, HSP90B1, CXCL5, CASP8, CASP3, FADD, MAP3K7, IL17RA, JUND, MUC5B, CHUK, FOS, TRAF3, TRAF2, IL17RE, NFKB1, IL17RC, IL17RB, IL17A, FOSL1, TRAF5, TRAF4, FOSB, TRAF6, ANAPC5, LCN2, TAB3, IL17F, TAB2, IL17D, IL17C, IL17B, CEBPB, CCL11, HSP90AB1, TRAF3IP2, IL25, PTGS2, IKBKB, S100A7A, MAPK9, MAPK8, TBK1, CCL7, MAPK3, CCL2, MAPK1, IKBKG, MAPK7, MAPK6, CCL17, IKBKE, MAPK4	['USP25', 'HSP90AA1', 'JUN', 'MMP1', 'CCL20', 'IL13', 'MMP3', 'MUC5AC', 'MAPK15', 'MMP9', 'MAPK13', 'MAPK14', 'CXCL10', 'IL5', 'MAPK11', 'MMP13', 'IL1B', 'IL4', 'MAPK12', 'NFKBIA', 'IL6', 'MAPK10', 'IFNG', 'S100A7', 'DEFB4B', 'S100A9', 'DEFB4A', 'S100A8', 'CXCL8', 'RELA', 'GSK3B', 'CSF3', 'CSF2', 'SRSF1', 'TRADD', 'TNFAIP3', 'CXCL2', 'TNF', 'CXCL1', 'ELAVL1', 'CXCL3', 'CXCL6', 'HSP90B1', 'CXCL5', 'CASP8', 'CASP3', 'FADD', 'MAP3K7', 'IL17RA', 'JUND', 'MUC5B', 'CHUK', 'FOS', 'TRAF3', 'TRAF2', 'IL17RE', 'NFKB1', 'IL17RC', 'IL17RB', 'IL17A', 'FOSL1', 'TRAF5', 'TRAF4', 'FOSB', 'TRAF6', 'ANAPC5', 'LCN2', 'TAB3', 'IL17F', 'TAB2', 'IL17D', 'IL17C', 'IL17B', 'CEBPB', 'CCL11', 'HSP90AB1', 'TRAF3IP2', 'IL25', 'PTGS2', 'IKBKB', 'S100A7A', 'MAPK9', 'MAPK8', 'TBK1', 'CCL7', 'MAPK3', 'CCL2', 'MAPK1', 'IKBKG', 'MAPK7', 'MAPK6', 'CCL17', 'IKBKE', 'MAPK4']	94	21.70212765957447	0.8936170212765957	0.1063829787234043
