Pathway	Count	Length	Genes	GeneList	GeneCount	AvgGeneFrequency	SharedGeneFraction	UniqueGeneFraction
Ubiquitin mediated proteolysis	2	140	UBE2H, FBXW7, MAP3K1, PPIL2, UBE2I, FBXW11, UBE2C, FBXW8, FBXO2, UBE2F, UBE2A, HUWE1, UBE2B, MID1, RBX1, CDC20, PML, UBE2W, UBE2Z, UBOX5, UBE2S, CDC16, UBE2U, UBE2O, NHLRC1, UBE2K, UBE2M, UBE2N, PRKN, KEAP1, UBE2D3, UBE2D4, UBE2D1, UBE2D2, UBE3A, CBLC, RNF7, UBE3B, CBLB, UBE3C, RCHY1, UBE2L6, UBE2L3, CDC23, HERC4, FZR1, HERC3, HERC2, CDC26, HERC1, CDC27, BTRC, SIAH1, PIAS4, FANCL, PIAS1, PIAS3, PIAS2, TRAF6, UBE2R2, BIRC6, UBA3, BIRC7, UBA2, UBA1, BIRC2, BIRC3, MDM2, SAE1, ANAPC13, CUL7, AIRE, CUL5, CUL3, CUL2, NEDD4L, CUL1, KLHL13, ANAPC10, RHOBTB1, ANAPC11, RHOBTB2, UBE2J1, UBE2J2, COP1, UBC, UBB, SKP1, SKP2, SMURF2, SMURF1, UBE2G2, UBE2G1, UBE2QL1, CUL4B, CUL4A, PRPF19, KLHL9, DET1, UBA7, UBA6, UBR5, BRCA1, SOCS3, SOCS1, UBE2Q2, UBE2Q1, RPS27A, UBE2E2, UBE4A, WWP1, SYVN1, UBE2E3, UBE4B, WWP2, UBE2E1, ITCH, DDB2, DDB1, CDC34, XIAP, NEDD4, ANAPC4, ERCC8, ANAPC5, TRIM37, TRIP12, ANAPC7, STUB1, TRIM32, UBA52, ANAPC1, ANAPC2, MGRN1, CBL, VHL, ELOB, FBXO4, UBE2NL, ELOC	['UBE2H', 'FBXW7', 'MAP3K1', 'PPIL2', 'UBE2I', 'FBXW11', 'UBE2C', 'FBXW8', 'FBXO2', 'UBE2F', 'UBE2A', 'HUWE1', 'UBE2B', 'MID1', 'RBX1', 'CDC20', 'PML', 'UBE2W', 'UBE2Z', 'UBOX5', 'UBE2S', 'CDC16', 'UBE2U', 'UBE2O', 'NHLRC1', 'UBE2K', 'UBE2M', 'UBE2N', 'PRKN', 'KEAP1', 'UBE2D3', 'UBE2D4', 'UBE2D1', 'UBE2D2', 'UBE3A', 'CBLC', 'RNF7', 'UBE3B', 'CBLB', 'UBE3C', 'RCHY1', 'UBE2L6', 'UBE2L3', 'CDC23', 'HERC4', 'FZR1', 'HERC3', 'HERC2', 'CDC26', 'HERC1', 'CDC27', 'BTRC', 'SIAH1', 'PIAS4', 'FANCL', 'PIAS1', 'PIAS3', 'PIAS2', 'TRAF6', 'UBE2R2', 'BIRC6', 'UBA3', 'BIRC7', 'UBA2', 'UBA1', 'BIRC2', 'BIRC3', 'MDM2', 'SAE1', 'ANAPC13', 'CUL7', 'AIRE', 'CUL5', 'CUL3', 'CUL2', 'NEDD4L', 'CUL1', 'KLHL13', 'ANAPC10', 'RHOBTB1', 'ANAPC11', 'RHOBTB2', 'UBE2J1', 'UBE2J2', 'COP1', 'UBC', 'UBB', 'SKP1', 'SKP2', 'SMURF2', 'SMURF1', 'UBE2G2', 'UBE2G1', 'UBE2QL1', 'CUL4B', 'CUL4A', 'PRPF19', 'KLHL9', 'DET1', 'UBA7', 'UBA6', 'UBR5', 'BRCA1', 'SOCS3', 'SOCS1', 'UBE2Q2', 'UBE2Q1', 'RPS27A', 'UBE2E2', 'UBE4A', 'WWP1', 'SYVN1', 'UBE2E3', 'UBE4B', 'WWP2', 'UBE2E1', 'ITCH', 'DDB2', 'DDB1', 'CDC34', 'XIAP', 'NEDD4', 'ANAPC4', 'ERCC8', 'ANAPC5', 'TRIM37', 'TRIP12', 'ANAPC7', 'STUB1', 'TRIM32', 'UBA52', 'ANAPC1', 'ANAPC2', 'MGRN1', 'CBL', 'VHL', 'ELOB', 'FBXO4', 'UBE2NL', 'ELOC']	140	3.892857142857143	0.6428571428571429	0.3571428571428571
Pyrimidine metabolism	1	56	ENTPD1, DUT, ENTPD3, ENTPD4, ENTPD5, ENTPD6, ENTPD8, NME3, NME4, NME6, UCKL1, NME1, UPB1, NME2, NT5C1A, NME7, RRM2B, DPYD, NT5C1B, DCTPP1, UMPS, CDA, TYMP, DTYMK, TYMS, NT5C2, PNP, NT5E, NT5C, TK1, NT5M, TK2, RRM2, CAD, RRM1, CTPS2, DCK, CTPS1, DHODH, NT5C3B, DCTD, NT5C3A, UCK2, UCK1, CMPK2, NT5C1B-RDH14, CMPK1, CANT1, DPYS, NUDT2, AK9, NME1-NME2, ENPP1, ENPP3, UPP2, UPP1	['ENTPD1', 'DUT', 'ENTPD3', 'ENTPD4', 'ENTPD5', 'ENTPD6', 'ENTPD8', 'NME3', 'NME4', 'NME6', 'UCKL1', 'NME1', 'UPB1', 'NME2', 'NT5C1A', 'NME7', 'RRM2B', 'DPYD', 'NT5C1B', 'DCTPP1', 'UMPS', 'CDA', 'TYMP', 'DTYMK', 'TYMS', 'NT5C2', 'PNP', 'NT5E', 'NT5C', 'TK1', 'NT5M', 'TK2', 'RRM2', 'CAD', 'RRM1', 'CTPS2', 'DCK', 'CTPS1', 'DHODH', 'NT5C3B', 'DCTD', 'NT5C3A', 'UCK2', 'UCK1', 'CMPK2', 'NT5C1B-RDH14', 'CMPK1', 'CANT1', 'DPYS', 'NUDT2', 'AK9', 'NME1-NME2', 'ENPP1', 'ENPP3', 'UPP2', 'UPP1']	56	2.625	0.875	0.125
Axon guidance	4	182	EPHA6, SEMA4A, EPHA5, SEMA4B, EPHA8, RYK, EPHA7, PLXNC1, SEMA4F, SEMA4C, WNT5A, SEMA4D, WNT5B, SEMA4G, BUB1B-PAK6, L1CAM, MYL5, CXCL12, PLXNB3, PLXNB2, PLXNB1, EPHA2, MYL9, EPHA1, NGEF, EPHA4, EPHA3, RAF1, SEMA5B, ROCK1, SEMA5A, ROCK2, NTN1, EFNA5, MYL12B, NTN3, PARD6G, NTN4, EFNB3, PARD6A, ABLIM1, DPYSL2, EFNB2, NRAS, ABLIM2, PAK2, ABLIM3, PAK1, PARD6B, DPYSL5, EFNB1, CFL2, CFL1, SLIT2, SLIT1, SLIT3, PAK4, PAK3, PAK6, PAK5, ARHGEF12, NTNG2, SEMA6C, SEMA6D, SEMA6A, TRPC6, FZD3, NTNG1, SEMA6B, TRPC4, TRPC5, TRPC3, PARD3, PRKCA, GDF7, SSH3, SSH1, PTK2, SSH2, EFNA2, EFNA1, MYL12A, EFNA4, PRKCZ, EFNA3, PIK3R1, SMO, PPP3R1, PPP3R2, RGS3, PLXNA3, PLXNA2, PLCG1, PLXNA1, ABL1, PLCG2, SRGAP3, SEMA7A, SRGAP2, SRGAP1, LRRC4C, PLXNA4, RHOA, LIMK1, LIMK2, NFATC4, NFATC3, PTCH1, PTPN11, NFATC2, RHOD, BMP7, RGMA, ENAH, RASA1, FES, PIK3CB, CDK5, PIK3CA, BMPR1B, BMPR2, GSK3B, ILK, LRRC4, PIK3R3, PIK3R2, PPP3CA, PPP3CB, PPP3CC, SHH, BOC, RRAS, TRPC1, WNT4, DCC, UNC5B, UNC5C, PDPK1, UNC5A, UNC5D, CDC42, MET, KRAS, NRP1, ROBO3, CAMK2D, EPHB6, ITGB1, SEMA3A, SRC, SEMA3D, SEMA3E, CAMK2A, SEMA3B, CAMK2B, SEMA3C, PIK3CD, SEMA3F, SEMA3G, GNAI1, GNAI2, RND1, ROBO1, GNAI3, ROBO2, CXCR4, LRIG2, MAPK3, RAC3, EPHB1, HRAS, MAPK1, RAC1, FYN, RAC2, CAMK2G, EPHB3, NEO1, EPHB2, NCK1, EPHB4, NCK2	['EPHA6', 'SEMA4A', 'EPHA5', 'SEMA4B', 'EPHA8', 'RYK', 'EPHA7', 'PLXNC1', 'SEMA4F', 'SEMA4C', 'WNT5A', 'SEMA4D', 'WNT5B', 'SEMA4G', 'BUB1B-PAK6', 'L1CAM', 'MYL5', 'CXCL12', 'PLXNB3', 'PLXNB2', 'PLXNB1', 'EPHA2', 'MYL9', 'EPHA1', 'NGEF', 'EPHA4', 'EPHA3', 'RAF1', 'SEMA5B', 'ROCK1', 'SEMA5A', 'ROCK2', 'NTN1', 'EFNA5', 'MYL12B', 'NTN3', 'PARD6G', 'NTN4', 'EFNB3', 'PARD6A', 'ABLIM1', 'DPYSL2', 'EFNB2', 'NRAS', 'ABLIM2', 'PAK2', 'ABLIM3', 'PAK1', 'PARD6B', 'DPYSL5', 'EFNB1', 'CFL2', 'CFL1', 'SLIT2', 'SLIT1', 'SLIT3', 'PAK4', 'PAK3', 'PAK6', 'PAK5', 'ARHGEF12', 'NTNG2', 'SEMA6C', 'SEMA6D', 'SEMA6A', 'TRPC6', 'FZD3', 'NTNG1', 'SEMA6B', 'TRPC4', 'TRPC5', 'TRPC3', 'PARD3', 'PRKCA', 'GDF7', 'SSH3', 'SSH1', 'PTK2', 'SSH2', 'EFNA2', 'EFNA1', 'MYL12A', 'EFNA4', 'PRKCZ', 'EFNA3', 'PIK3R1', 'SMO', 'PPP3R1', 'PPP3R2', 'RGS3', 'PLXNA3', 'PLXNA2', 'PLCG1', 'PLXNA1', 'ABL1', 'PLCG2', 'SRGAP3', 'SEMA7A', 'SRGAP2', 'SRGAP1', 'LRRC4C', 'PLXNA4', 'RHOA', 'LIMK1', 'LIMK2', 'NFATC4', 'NFATC3', 'PTCH1', 'PTPN11', 'NFATC2', 'RHOD', 'BMP7', 'RGMA', 'ENAH', 'RASA1', 'FES', 'PIK3CB', 'CDK5', 'PIK3CA', 'BMPR1B', 'BMPR2', 'GSK3B', 'ILK', 'LRRC4', 'PIK3R3', 'PIK3R2', 'PPP3CA', 'PPP3CB', 'PPP3CC', 'SHH', 'BOC', 'RRAS', 'TRPC1', 'WNT4', 'DCC', 'UNC5B', 'UNC5C', 'PDPK1', 'UNC5A', 'UNC5D', 'CDC42', 'MET', 'KRAS', 'NRP1', 'ROBO3', 'CAMK2D', 'EPHB6', 'ITGB1', 'SEMA3A', 'SRC', 'SEMA3D', 'SEMA3E', 'CAMK2A', 'SEMA3B', 'CAMK2B', 'SEMA3C', 'PIK3CD', 'SEMA3F', 'SEMA3G', 'GNAI1', 'GNAI2', 'RND1', 'ROBO1', 'GNAI3', 'ROBO2', 'CXCR4', 'LRIG2', 'MAPK3', 'RAC3', 'EPHB1', 'HRAS', 'MAPK1', 'RAC1', 'FYN', 'RAC2', 'CAMK2G', 'EPHB3', 'NEO1', 'EPHB2', 'NCK1', 'EPHB4', 'NCK2']	182	14.741758241758241	0.6153846153846154	0.3846153846153846
Signaling pathways regulating pluripotency of stem cells	2	143	ACVR1, PCGF5, PCGF6, ESX1, PCGF3, WNT5A, WNT5B, LIFR, ISL1, MAPK13, MAPK14, MAPK11, MAPK12, APC, KAT6A, IL6ST, RAF1, HOXB1, FZD10, NRAS, AKT3, MYC, AKT1, AKT2, SMARCAD1, HOXA1, ESRRB, FZD2, SMAD3, FZD1, SMAD2, FZD4, MAP2K2, SMAD5, WNT10B, FZD3, SMAD4, WNT10A, FZD6, WNT3A, FZD5, MAP2K1, FZD8, SMAD1, FZD7, INHBA, FZD9, IGF1, INHBC, INHBB, INHBE, SMAD9, PIK3R1, COMMD3-BMI1, FGFR1, TCF7, GRB2, LHX5, NANOG, TCF3, FGFR4, NODAL, FGFR3, MYF5, FGFR2, WNT2B, HOXD1, RIF1, FGF2, IGF1R, SOX2, HESX1, POU5F1B, ZFHX3, SETDB1, AXIN2, AXIN1, LIF, WNT9A, PAX6, WNT9B, DUSP9, ACVR2B, ACVR2A, WNT16, BMP4, MEIS1, ID1, PIK3CB, PIK3CA, ID3, ID2, ID4, BMPR1A, BMPR1B, BMPR2, GSK3B, DLX5, ONECUT1, WNT8B, PIK3R3, PIK3R2, WNT8A, BMI1, WNT6, WNT11, DVL1, DVL2, DVL3, OTX1, JARID2, WNT1, SKIL, WNT2, WNT3, WNT4, LEFTY2, APC2, LEFTY1, STAT3, WNT7A, WNT7B, KLF4, POU5F1, TBX3, HAND1, REST, KRAS, NANOGP8, NEUROG1, CTNNB1, PIK3CD, ACVR1C, ACVR1B, ZIC3, MAPK3, PCGF1, PCGF2, HRAS, MAPK1, JAK3, JAK1, JAK2	['ACVR1', 'PCGF5', 'PCGF6', 'ESX1', 'PCGF3', 'WNT5A', 'WNT5B', 'LIFR', 'ISL1', 'MAPK13', 'MAPK14', 'MAPK11', 'MAPK12', 'APC', 'KAT6A', 'IL6ST', 'RAF1', 'HOXB1', 'FZD10', 'NRAS', 'AKT3', 'MYC', 'AKT1', 'AKT2', 'SMARCAD1', 'HOXA1', 'ESRRB', 'FZD2', 'SMAD3', 'FZD1', 'SMAD2', 'FZD4', 'MAP2K2', 'SMAD5', 'WNT10B', 'FZD3', 'SMAD4', 'WNT10A', 'FZD6', 'WNT3A', 'FZD5', 'MAP2K1', 'FZD8', 'SMAD1', 'FZD7', 'INHBA', 'FZD9', 'IGF1', 'INHBC', 'INHBB', 'INHBE', 'SMAD9', 'PIK3R1', 'COMMD3-BMI1', 'FGFR1', 'TCF7', 'GRB2', 'LHX5', 'NANOG', 'TCF3', 'FGFR4', 'NODAL', 'FGFR3', 'MYF5', 'FGFR2', 'WNT2B', 'HOXD1', 'RIF1', 'FGF2', 'IGF1R', 'SOX2', 'HESX1', 'POU5F1B', 'ZFHX3', 'SETDB1', 'AXIN2', 'AXIN1', 'LIF', 'WNT9A', 'PAX6', 'WNT9B', 'DUSP9', 'ACVR2B', 'ACVR2A', 'WNT16', 'BMP4', 'MEIS1', 'ID1', 'PIK3CB', 'PIK3CA', 'ID3', 'ID2', 'ID4', 'BMPR1A', 'BMPR1B', 'BMPR2', 'GSK3B', 'DLX5', 'ONECUT1', 'WNT8B', 'PIK3R3', 'PIK3R2', 'WNT8A', 'BMI1', 'WNT6', 'WNT11', 'DVL1', 'DVL2', 'DVL3', 'OTX1', 'JARID2', 'WNT1', 'SKIL', 'WNT2', 'WNT3', 'WNT4', 'LEFTY2', 'APC2', 'LEFTY1', 'STAT3', 'WNT7A', 'WNT7B', 'KLF4', 'POU5F1', 'TBX3', 'HAND1', 'REST', 'KRAS', 'NANOGP8', 'NEUROG1', 'CTNNB1', 'PIK3CD', 'ACVR1C', 'ACVR1B', 'ZIC3', 'MAPK3', 'PCGF1', 'PCGF2', 'HRAS', 'MAPK1', 'JAK3', 'JAK1', 'JAK2']	143	20.74125874125874	0.8041958041958042	0.19580419580419584
Adrenergic signaling in cardiomyocytes	1	150	TPM4, CACNA2D2, TPM3, CACNA2D1, TPM2, CACNA2D4, CACNA2D3, ATP1B4, PPP2R1A, ATP1B3, ATP1B2, AGT, ATP1B1, MAPK13, PPP1CA, MAPK14, PPP1CB, MAPK11, MAPK12, MYL2, MYL3, MYL4, AGTR2, AGTR1, CALM2, CALM3, CALM1, ATF2, ADCY1, CALML6, ATF6B, ADCY5, ADCY4, ATP1A4, CALML3, ADCY3, ATP1A3, CALML4, ADCY2, ATP1A2, CALML5, ADCY9, ATP1A1, ADCY8, ADCY7, SLC9A1, ADCY6, PPP1CC, CREB3L1, CREB3L4, AKT3, CREB3L2, SCN7A, CREB3L3, AKT1, TPM1, AKT2, TNNC1, PRKCA, KCNE1B, CACNB2, CREB3, CACNB3, CACNB4, CREB1, PPP1R1A, TNNT2, GNAQ, GNAS, ATF4, CREB5, CACNB1, KCNE1, CACNA1C, CREM, CACNA1D, CACNA1F, PRKACG, CACNA1S, PRKACB, PRKACA, SCN1B, PPP2R5C, PPP2R5B, PPP2R5E, PPP2R5D, PPP2R5A, FXYD2, BCL2, RAPGEF3, SCN4B, MYH6, MYH7, RAPGEF4, PIK3R5, ADRB1, ADRB2, ADRA1D, ADRA1B, ADRA1A, PIK3R6, PPP2R3A, ATP2B4, ATP2B3, PPP2R3C, ATP2B2, PPP2R3B, ATP2B1, PPP2CA, PLCB4, PPP2R2D, KCNQ1, PPP2R2C, PLCB2, PLCB3, PLCB1, RYR2, CAMK2D, CAMK2A, CAMK2B, ATP2A3, ATP2A2, PPP2R2B, ATP2A1, PPP2R2A, ACTC1, GNAI1, SLC8A1, GNAI2, SLC8A2, GNAI3, PIK3CG, SLC8A3, CACNG7, PLN, PPP2CB, RPS6KA5, CACNG8, PPP2R1B, MAPK3, SCN5A, TNNI3, CACNG1, MAPK1, CACNG2, CACNG3, CAMK2G, CACNG4, CACNG5, CACNG6	['TPM4', 'CACNA2D2', 'TPM3', 'CACNA2D1', 'TPM2', 'CACNA2D4', 'CACNA2D3', 'ATP1B4', 'PPP2R1A', 'ATP1B3', 'ATP1B2', 'AGT', 'ATP1B1', 'MAPK13', 'PPP1CA', 'MAPK14', 'PPP1CB', 'MAPK11', 'MAPK12', 'MYL2', 'MYL3', 'MYL4', 'AGTR2', 'AGTR1', 'CALM2', 'CALM3', 'CALM1', 'ATF2', 'ADCY1', 'CALML6', 'ATF6B', 'ADCY5', 'ADCY4', 'ATP1A4', 'CALML3', 'ADCY3', 'ATP1A3', 'CALML4', 'ADCY2', 'ATP1A2', 'CALML5', 'ADCY9', 'ATP1A1', 'ADCY8', 'ADCY7', 'SLC9A1', 'ADCY6', 'PPP1CC', 'CREB3L1', 'CREB3L4', 'AKT3', 'CREB3L2', 'SCN7A', 'CREB3L3', 'AKT1', 'TPM1', 'AKT2', 'TNNC1', 'PRKCA', 'KCNE1B', 'CACNB2', 'CREB3', 'CACNB3', 'CACNB4', 'CREB1', 'PPP1R1A', 'TNNT2', 'GNAQ', 'GNAS', 'ATF4', 'CREB5', 'CACNB1', 'KCNE1', 'CACNA1C', 'CREM', 'CACNA1D', 'CACNA1F', 'PRKACG', 'CACNA1S', 'PRKACB', 'PRKACA', 'SCN1B', 'PPP2R5C', 'PPP2R5B', 'PPP2R5E', 'PPP2R5D', 'PPP2R5A', 'FXYD2', 'BCL2', 'RAPGEF3', 'SCN4B', 'MYH6', 'MYH7', 'RAPGEF4', 'PIK3R5', 'ADRB1', 'ADRB2', 'ADRA1D', 'ADRA1B', 'ADRA1A', 'PIK3R6', 'PPP2R3A', 'ATP2B4', 'ATP2B3', 'PPP2R3C', 'ATP2B2', 'PPP2R3B', 'ATP2B1', 'PPP2CA', 'PLCB4', 'PPP2R2D', 'KCNQ1', 'PPP2R2C', 'PLCB2', 'PLCB3', 'PLCB1', 'RYR2', 'CAMK2D', 'CAMK2A', 'CAMK2B', 'ATP2A3', 'ATP2A2', 'PPP2R2B', 'ATP2A1', 'PPP2R2A', 'ACTC1', 'GNAI1', 'SLC8A1', 'GNAI2', 'SLC8A2', 'GNAI3', 'PIK3CG', 'SLC8A3', 'CACNG7', 'PLN', 'PPP2CB', 'RPS6KA5', 'CACNG8', 'PPP2R1B', 'MAPK3', 'SCN5A', 'TNNI3', 'CACNG1', 'MAPK1', 'CACNG2', 'CACNG3', 'CAMK2G', 'CACNG4', 'CACNG5', 'CACNG6']	150	24.793333333333333	0.9533333333333334	0.046666666666666634
Cholinergic synapse	2	113	CHRNB2, CHRNB4, SLC5A7, CHRM3, CHRM4, CHRM1, CHRNA4, CHRM2, CHRNA3, ADCY1, CHRNA6, CHRM5, CHRNA7, ADCY5, ADCY4, ADCY3, ADCY2, ADCY9, ADCY8, ADCY7, ADCY6, GNG2, CREB3L1, NRAS, GNG4, GNG3, CREB3L4, GNG5, AKT3, CREB3L2, GNG8, CREB3L3, GNG7, AKT1, AKT2, PRKCG, MAP2K1, PRKCB, PRKCA, CREB3, CREB1, GNB1, PIK3R1, GNB3, GNAQ, GNB2, GNB5, GNB4, ATF4, CREB5, CACNA1A, CACNA1C, CHAT, CACNA1B, CACNA1D, CACNA1F, PRKACG, GNG11, GNG10, CACNA1S, PRKACB, PRKACA, KCNJ6, KCNJ12, KCNJ14, KCNJ18, GNG13, GNG12, PIK3CB, PIK3CA, GNAO1, BCL2, CAMK4, ACHE, ITPR2, PIK3R5, ITPR3, PIK3R3, PIK3R2, ITPR1, PIK3R6, GNGT2, GNGT1, SLC18A3, FOS, PLCB4, KCNQ1, KCNQ2, KCNQ3, KCNQ4, KCNQ5, KRAS, PLCB2, PLCB3, PLCB1, CAMK2D, CAMK2A, CAMK2B, PIK3CD, GNAI1, GNAI2, GNAI3, PIK3CG, GNA11, MAPK3, HRAS, MAPK1, FYN, CAMK2G, KCNJ2, KCNJ3, JAK2, KCNJ4	['CHRNB2', 'CHRNB4', 'SLC5A7', 'CHRM3', 'CHRM4', 'CHRM1', 'CHRNA4', 'CHRM2', 'CHRNA3', 'ADCY1', 'CHRNA6', 'CHRM5', 'CHRNA7', 'ADCY5', 'ADCY4', 'ADCY3', 'ADCY2', 'ADCY9', 'ADCY8', 'ADCY7', 'ADCY6', 'GNG2', 'CREB3L1', 'NRAS', 'GNG4', 'GNG3', 'CREB3L4', 'GNG5', 'AKT3', 'CREB3L2', 'GNG8', 'CREB3L3', 'GNG7', 'AKT1', 'AKT2', 'PRKCG', 'MAP2K1', 'PRKCB', 'PRKCA', 'CREB3', 'CREB1', 'GNB1', 'PIK3R1', 'GNB3', 'GNAQ', 'GNB2', 'GNB5', 'GNB4', 'ATF4', 'CREB5', 'CACNA1A', 'CACNA1C', 'CHAT', 'CACNA1B', 'CACNA1D', 'CACNA1F', 'PRKACG', 'GNG11', 'GNG10', 'CACNA1S', 'PRKACB', 'PRKACA', 'KCNJ6', 'KCNJ12', 'KCNJ14', 'KCNJ18', 'GNG13', 'GNG12', 'PIK3CB', 'PIK3CA', 'GNAO1', 'BCL2', 'CAMK4', 'ACHE', 'ITPR2', 'PIK3R5', 'ITPR3', 'PIK3R3', 'PIK3R2', 'ITPR1', 'PIK3R6', 'GNGT2', 'GNGT1', 'SLC18A3', 'FOS', 'PLCB4', 'KCNQ1', 'KCNQ2', 'KCNQ3', 'KCNQ4', 'KCNQ5', 'KRAS', 'PLCB2', 'PLCB3', 'PLCB1', 'CAMK2D', 'CAMK2A', 'CAMK2B', 'PIK3CD', 'GNAI1', 'GNAI2', 'GNAI3', 'PIK3CG', 'GNA11', 'MAPK3', 'HRAS', 'MAPK1', 'FYN', 'CAMK2G', 'KCNJ2', 'KCNJ3', 'JAK2', 'KCNJ4']	113	35.61946902654867	0.9646017699115044	0.03539823008849563
Oxytocin signaling pathway	1	154	GUCY1A2, GUCY1A1, CACNA2D2, CACNA2D1, CACNA2D4, CACNA2D3, PRKAB1, PRKAB2, PPP1CA, PPP1CB, MYL6, CALM2, MYL9, CALM3, CALM1, RAF1, PRKAA2, ROCK1, ADCY1, CALML6, ROCK2, ADCY5, ADCY4, CALML3, ADCY3, CALML4, ADCY2, CALML5, ADCY9, ADCY8, EGFR, PRKAA1, ADCY7, ADCY6, PPP1CC, ACTB, NRAS, CCND1, MAP2K5, PRKCG, MAP2K2, PLA2G4E, MAP2K1, PLA2G4F, PLA2G4C, PLA2G4D, PLA2G4A, PLA2G4B, PRKCB, EEF2, PRKCA, CACNB2, RCAN1, CACNB3, CACNB4, GNAQ, GNAS, CACNB1, OXTR, GUCY1B1, ACTG1, CACNA1C, CACNA1D, ELK1, CACNA1F, MYL6B, MYLK, TRPM2, PPP3R1, PRKACG, EEF2K, PPP3R2, RGS2, NPPA, CACNA1S, PRKACB, PRKACA, KCNJ5, KCNJ6, RHOA, PPP1R12A, JUN, PPP1R12B, KCNJ12, KCNJ9, KCNJ14, NFATC4, NFATC3, KCNJ18, NFATC2, NFATC1, GNAO1, CAMK4, CAMK1, PPP1R12C, NPR1, NPR2, ITPR2, PIK3R5, ITPR3, OXT, ITPR1, PIK3R6, PPP3CA, PPP3CB, PPP3CC, CD38, CAMK1D, MEF2C, NOS3, FOS, PLCB4, JMJD7-PLA2G4B, KRAS, PLCB2, CAMK1G, PLCB3, PLCB1, MYLK2, RYR2, CAMK2D, MYLK3, RYR3, SRC, RYR1, CDKN1A, CAMK2A, CAMK2B, PRKAG2, PRKAG3, PRKAG1, GNAI1, CAMKK2, GNAI2, MYLK4, GNAI3, PIK3CG, PTGS2, CACNG7, CACNG8, MAPK3, CACNG1, HRAS, MAPK1, CACNG2, CACNG3, CAMK2G, MAPK7, CACNG4, KCNJ2, CACNG5, KCNJ3, CACNG6, KCNJ4	['GUCY1A2', 'GUCY1A1', 'CACNA2D2', 'CACNA2D1', 'CACNA2D4', 'CACNA2D3', 'PRKAB1', 'PRKAB2', 'PPP1CA', 'PPP1CB', 'MYL6', 'CALM2', 'MYL9', 'CALM3', 'CALM1', 'RAF1', 'PRKAA2', 'ROCK1', 'ADCY1', 'CALML6', 'ROCK2', 'ADCY5', 'ADCY4', 'CALML3', 'ADCY3', 'CALML4', 'ADCY2', 'CALML5', 'ADCY9', 'ADCY8', 'EGFR', 'PRKAA1', 'ADCY7', 'ADCY6', 'PPP1CC', 'ACTB', 'NRAS', 'CCND1', 'MAP2K5', 'PRKCG', 'MAP2K2', 'PLA2G4E', 'MAP2K1', 'PLA2G4F', 'PLA2G4C', 'PLA2G4D', 'PLA2G4A', 'PLA2G4B', 'PRKCB', 'EEF2', 'PRKCA', 'CACNB2', 'RCAN1', 'CACNB3', 'CACNB4', 'GNAQ', 'GNAS', 'CACNB1', 'OXTR', 'GUCY1B1', 'ACTG1', 'CACNA1C', 'CACNA1D', 'ELK1', 'CACNA1F', 'MYL6B', 'MYLK', 'TRPM2', 'PPP3R1', 'PRKACG', 'EEF2K', 'PPP3R2', 'RGS2', 'NPPA', 'CACNA1S', 'PRKACB', 'PRKACA', 'KCNJ5', 'KCNJ6', 'RHOA', 'PPP1R12A', 'JUN', 'PPP1R12B', 'KCNJ12', 'KCNJ9', 'KCNJ14', 'NFATC4', 'NFATC3', 'KCNJ18', 'NFATC2', 'NFATC1', 'GNAO1', 'CAMK4', 'CAMK1', 'PPP1R12C', 'NPR1', 'NPR2', 'ITPR2', 'PIK3R5', 'ITPR3', 'OXT', 'ITPR1', 'PIK3R6', 'PPP3CA', 'PPP3CB', 'PPP3CC', 'CD38', 'CAMK1D', 'MEF2C', 'NOS3', 'FOS', 'PLCB4', 'JMJD7-PLA2G4B', 'KRAS', 'PLCB2', 'CAMK1G', 'PLCB3', 'PLCB1', 'MYLK2', 'RYR2', 'CAMK2D', 'MYLK3', 'RYR3', 'SRC', 'RYR1', 'CDKN1A', 'CAMK2A', 'CAMK2B', 'PRKAG2', 'PRKAG3', 'PRKAG1', 'GNAI1', 'CAMKK2', 'GNAI2', 'MYLK4', 'GNAI3', 'PIK3CG', 'PTGS2', 'CACNG7', 'CACNG8', 'MAPK3', 'CACNG1', 'HRAS', 'MAPK1', 'CACNG2', 'CACNG3', 'CAMK2G', 'MAPK7', 'CACNG4', 'KCNJ2', 'CACNG5', 'KCNJ3', 'CACNG6', 'KCNJ4']	154	27.116883116883116	1.0	0.0
Vascular smooth muscle contraction	3	133	GUCY1A2, GUCY1A1, IRAG1, AGT, PPP1CA, PPP1CB, MYL6, AGTR1, CALM2, MYL9, CALM3, CALM1, RAF1, RAMP3, ROCK1, ADCY1, CALML6, ROCK2, ADCY5, ADCY4, CALML3, ADCY3, CALML4, ADCY2, ARAF, CALML5, ADCY9, ADCY8, ADCY7, ADCY6, PPP1CC, MYH14, MYH10, MYH11, ARHGEF12, PRKCH, ARHGEF11, PRKCG, MAP2K2, PLA2G4E, PRKCD, MAP2K1, PLA2G4F, PLA2G4C, PLA2G4D, PRKCE, PLA2G4A, PLA2G4B, AVPR1A, PRKCB, AVPR1B, PRKCA, KCNU1, KCNMA1, GNAQ, GNAS, PRKCQ, CALCB, CALCRL, GUCY1B1, CALCA, CACNA1C, PLA2G3, PLA2G5, CACNA1D, PLA2G6, CACNA1F, MYL6B, MYLK, ACTG2, NPPC, PRKACG, CALD1, KCNMB1, KCNMB2, NPPA, KCNMB3, NPPB, CACNA1S, KCNMB4, PRKACB, PRKACA, EDN1, RHOA, EDN2, PLA2G2E, PPP1R12A, EDN3, PLA2G2F, PPP1R12B, PLA2G2C, PLA2G2D, PLA2G2A, BRAF, ACTA2, ADORA2B, ADORA2A, MYH9, PPP1R12C, NPR1, ARHGEF1, NPR2, ITPR2, ADM, ITPR3, ADRA1D, ADRA1B, ADRA1A, ITPR1, PRKG1, PPP1R14A, PLA2G12A, PLA2G12B, PTGIR, PLCB4, PLA2G10, JMJD7-PLA2G4B, AVP, PLCB2, RAMP1, PLCB3, RAMP2, PLCB1, MYLK2, MYLK3, PLA2G1B, MYLK4, EDNRA, GNA11, GNA12, GNA13, MAPK3, MAPK1	['GUCY1A2', 'GUCY1A1', 'IRAG1', 'AGT', 'PPP1CA', 'PPP1CB', 'MYL6', 'AGTR1', 'CALM2', 'MYL9', 'CALM3', 'CALM1', 'RAF1', 'RAMP3', 'ROCK1', 'ADCY1', 'CALML6', 'ROCK2', 'ADCY5', 'ADCY4', 'CALML3', 'ADCY3', 'CALML4', 'ADCY2', 'ARAF', 'CALML5', 'ADCY9', 'ADCY8', 'ADCY7', 'ADCY6', 'PPP1CC', 'MYH14', 'MYH10', 'MYH11', 'ARHGEF12', 'PRKCH', 'ARHGEF11', 'PRKCG', 'MAP2K2', 'PLA2G4E', 'PRKCD', 'MAP2K1', 'PLA2G4F', 'PLA2G4C', 'PLA2G4D', 'PRKCE', 'PLA2G4A', 'PLA2G4B', 'AVPR1A', 'PRKCB', 'AVPR1B', 'PRKCA', 'KCNU1', 'KCNMA1', 'GNAQ', 'GNAS', 'PRKCQ', 'CALCB', 'CALCRL', 'GUCY1B1', 'CALCA', 'CACNA1C', 'PLA2G3', 'PLA2G5', 'CACNA1D', 'PLA2G6', 'CACNA1F', 'MYL6B', 'MYLK', 'ACTG2', 'NPPC', 'PRKACG', 'CALD1', 'KCNMB1', 'KCNMB2', 'NPPA', 'KCNMB3', 'NPPB', 'CACNA1S', 'KCNMB4', 'PRKACB', 'PRKACA', 'EDN1', 'RHOA', 'EDN2', 'PLA2G2E', 'PPP1R12A', 'EDN3', 'PLA2G2F', 'PPP1R12B', 'PLA2G2C', 'PLA2G2D', 'PLA2G2A', 'BRAF', 'ACTA2', 'ADORA2B', 'ADORA2A', 'MYH9', 'PPP1R12C', 'NPR1', 'ARHGEF1', 'NPR2', 'ITPR2', 'ADM', 'ITPR3', 'ADRA1D', 'ADRA1B', 'ADRA1A', 'ITPR1', 'PRKG1', 'PPP1R14A', 'PLA2G12A', 'PLA2G12B', 'PTGIR', 'PLCB4', 'PLA2G10', 'JMJD7-PLA2G4B', 'AVP', 'PLCB2', 'RAMP1', 'PLCB3', 'RAMP2', 'PLCB1', 'MYLK2', 'MYLK3', 'PLA2G1B', 'MYLK4', 'EDNRA', 'GNA11', 'GNA12', 'GNA13', 'MAPK3', 'MAPK1']	133	23.36842105263158	0.9548872180451128	0.045112781954887216
Renin secretion	2	69	CTSB, EDN1, ACE, EDN2, GUCY1A2, EDN3, GUCY1A1, AGT, PDE3B, AGTR1, PDE3A, ORAI1, REN, CALM2, CALM3, CALM1, CALML6, NPR1, ADCY5, ITPR2, ADRB1, CALML3, ITPR3, ADRB2, CALML4, ADRB3, CALML5, AQP1, ADCY6, ITPR1, PPP3CA, PPP3CB, PPP3CC, ADORA1, PRKG2, ADCYAP1, CREB1, PLCB4, KCNMA1, GNAQ, GNAS, PLCB2, PLCB3, PLCB1, GUCY1B1, PDE1C, PTGER2, PDE1B, PDE1A, PTGER4, CACNA1C, CACNA1D, ADCYAP1R1, CACNA1F, GNAI1, GNAI2, GNAI3, EDNRA, PPP3R1, PRKACG, PPP3R2, NPPA, CACNA1S, CLCA2, CLCA1, PRKACB, KCNJ2, CLCA4, PRKACA	['CTSB', 'EDN1', 'ACE', 'EDN2', 'GUCY1A2', 'EDN3', 'GUCY1A1', 'AGT', 'PDE3B', 'AGTR1', 'PDE3A', 'ORAI1', 'REN', 'CALM2', 'CALM3', 'CALM1', 'CALML6', 'NPR1', 'ADCY5', 'ITPR2', 'ADRB1', 'CALML3', 'ITPR3', 'ADRB2', 'CALML4', 'ADRB3', 'CALML5', 'AQP1', 'ADCY6', 'ITPR1', 'PPP3CA', 'PPP3CB', 'PPP3CC', 'ADORA1', 'PRKG2', 'ADCYAP1', 'CREB1', 'PLCB4', 'KCNMA1', 'GNAQ', 'GNAS', 'PLCB2', 'PLCB3', 'PLCB1', 'GUCY1B1', 'PDE1C', 'PTGER2', 'PDE1B', 'PDE1A', 'PTGER4', 'CACNA1C', 'CACNA1D', 'ADCYAP1R1', 'CACNA1F', 'GNAI1', 'GNAI2', 'GNAI3', 'EDNRA', 'PPP3R1', 'PRKACG', 'PPP3R2', 'NPPA', 'CACNA1S', 'CLCA2', 'CLCA1', 'PRKACB', 'KCNJ2', 'CLCA4', 'PRKACA']	69	25.89855072463768	1.0	0.0
Synaptic vesicle cycle	2	78	UNC13C, UNC13A, ATP6V1E1, UNC13B, DNM1, DNM2, DNM3, STX1B, STX1A, SNAP25, STXBP1, ATP6V0D1, SLC1A1, NAPA, SLC1A2, CLTC, SLC1A3, CLTB, CLTA, SLC1A6, SLC1A7, CLTCL1, AP2S1, ATP6V1E2, SLC18A1, STX3, SLC18A2, STX2, SLC18A3, ATP6V1G1, NSF, ATP6V0C, ATP6V0E1, ATP6V1G2, ATP6V0B, ATP6V0E2, ATP6V1G3, SLC32A1, SYT1, AP2B1, SLC6A13, SLC6A12, SLC6A11, SLC6A7, SLC6A9, VAMP2, ATP6V0D2, ATP6V1B1, ATP6V1B2, ATP6V1A, ATP6V1D, CPLX1, RAB3A, CACNA1A, TCIRG1, CACNA1B, AP2A2, AP2A1, SLC6A1, CPLX3, SLC6A2, CPLX2, SLC6A3, SLC6A4, CPLX4, SLC6A5, RIMS1, SLC17A6, ATP6V0A4, SLC17A7, SLC17A8, ATP6V1F, ATP6V1C1, ATP6V0A1, ATP6V1C2, ATP6V1H, AP2M1, ATP6V0A2	['UNC13C', 'UNC13A', 'ATP6V1E1', 'UNC13B', 'DNM1', 'DNM2', 'DNM3', 'STX1B', 'STX1A', 'SNAP25', 'STXBP1', 'ATP6V0D1', 'SLC1A1', 'NAPA', 'SLC1A2', 'CLTC', 'SLC1A3', 'CLTB', 'CLTA', 'SLC1A6', 'SLC1A7', 'CLTCL1', 'AP2S1', 'ATP6V1E2', 'SLC18A1', 'STX3', 'SLC18A2', 'STX2', 'SLC18A3', 'ATP6V1G1', 'NSF', 'ATP6V0C', 'ATP6V0E1', 'ATP6V1G2', 'ATP6V0B', 'ATP6V0E2', 'ATP6V1G3', 'SLC32A1', 'SYT1', 'AP2B1', 'SLC6A13', 'SLC6A12', 'SLC6A11', 'SLC6A7', 'SLC6A9', 'VAMP2', 'ATP6V0D2', 'ATP6V1B1', 'ATP6V1B2', 'ATP6V1A', 'ATP6V1D', 'CPLX1', 'RAB3A', 'CACNA1A', 'TCIRG1', 'CACNA1B', 'AP2A2', 'AP2A1', 'SLC6A1', 'CPLX3', 'SLC6A2', 'CPLX2', 'SLC6A3', 'SLC6A4', 'CPLX4', 'SLC6A5', 'RIMS1', 'SLC17A6', 'ATP6V0A4', 'SLC17A7', 'SLC17A8', 'ATP6V1F', 'ATP6V1C1', 'ATP6V0A1', 'ATP6V1C2', 'ATP6V1H', 'AP2M1', 'ATP6V0A2']	78	5.282051282051282	0.8205128205128205	0.17948717948717952
Various types of N-glycan biosynthesis	1	39	CHST9, ALG9, CHST8, ALG3, ALG14, ALG1, ALG13, ALG12, ALG2, ALG11, MGAT4D, DDOST, MGAT4A, DAD1, MGAT4B, MGAT4C, MAN1B1, STT3B, STT3A, B4GALT3, B4GALT1, B4GALT2, HEXA, RPN1, TUSC3, HEXB, RPN2, HEXD, FUT8, MAN2A2, MAN1C1, MAN1A2, MAN2A1, MGAT2, MAN1A1, B4GALNT4, B4GALNT3, MGAT1, ST3GAL3	['CHST9', 'ALG9', 'CHST8', 'ALG3', 'ALG14', 'ALG1', 'ALG13', 'ALG12', 'ALG2', 'ALG11', 'MGAT4D', 'DDOST', 'MGAT4A', 'DAD1', 'MGAT4B', 'MGAT4C', 'MAN1B1', 'STT3B', 'STT3A', 'B4GALT3', 'B4GALT1', 'B4GALT2', 'HEXA', 'RPN1', 'TUSC3', 'HEXB', 'RPN2', 'HEXD', 'FUT8', 'MAN2A2', 'MAN1C1', 'MAN1A2', 'MAN2A1', 'MGAT2', 'MAN1A1', 'B4GALNT4', 'B4GALNT3', 'MGAT1', 'ST3GAL3']	39	2.871794871794872	0.8974358974358975	0.10256410256410253
Cell adhesion molecules	4	148	CADM3, CADM1, VCAM1, L1CAM, CD2, CD4, CD6, CNTN2, PDCD1, CNTN1, CD86, VTCN1, CD80, PVR, CLDN3, CLDN2, CLDN1, CDH5, CDH4, CDH3, CDH2, CDH1, MPZ, JAM2, HLA-DOB, JAM3, HLA-DOA, NTNG2, HLA-DRB5, NTNG1, HLA-C, CD8B2, HLA-A, HLA-B, HLA-G, SELE, HLA-E, HLA-F, IGSF11, OCLN, MAG, SELP, CD8B, CD8A, SELL, SDC1, ESAM, SDC2, CDH15, HLA-DRB4, HLA-DRB3, HLA-DRB1, CD276, CD274, ICAM3, F11R, ICAM1, ICAM2, ALCAM, LRRC4B, CD99, LRRC4C, ITGA4, PDCD1LG2, CLDN11, PTPRF, VCAN, CLDN10, PTPRC, CLDN16, SIGLEC1, CLDN15, CLDN14, HLA-DQB1, HLA-DRA, ITGA9, CD28, CLDN19, ITGA8, PECAM1, CLDN18, CLDN17, ITGA6, CD22, CNTNAP2, NLGN2, CD40, CNTNAP1, NLGN3, NCAM1, NLGN1, NRXN2, SDC3, NRXN1, SDC4, PTPRM, LRRC4, NRXN3, CD99L2, GLG1, SPN, MADCAM1, MPZL1, CTLA4, NCAM2, CD34, HLA-DQA2, HLA-DQA1, ICOS, NLGN4X, NLGN4Y, NEGR1, CLDN34, CLDN7, CLDN6, CLDN5, CLDN4, NFASC, CLDN9, CLDN8, NECTIN1, HLA-DPB1, CD226, CD40LG, NECTIN3, NECTIN2, ITGB2, ITGB1, SELPLG, ITGAM, ITGAL, VSIR, CLDN23, CLDN22, HLA-DMB, CLDN20, CLDN25, CLDN24, HLA-DPA1, ITGB8, ITGAV, ITGB7, NRCAM, CD58, NEO1, HLA-DMA, TIGIT, ICOSLG	['CADM3', 'CADM1', 'VCAM1', 'L1CAM', 'CD2', 'CD4', 'CD6', 'CNTN2', 'PDCD1', 'CNTN1', 'CD86', 'VTCN1', 'CD80', 'PVR', 'CLDN3', 'CLDN2', 'CLDN1', 'CDH5', 'CDH4', 'CDH3', 'CDH2', 'CDH1', 'MPZ', 'JAM2', 'HLA-DOB', 'JAM3', 'HLA-DOA', 'NTNG2', 'HLA-DRB5', 'NTNG1', 'HLA-C', 'CD8B2', 'HLA-A', 'HLA-B', 'HLA-G', 'SELE', 'HLA-E', 'HLA-F', 'IGSF11', 'OCLN', 'MAG', 'SELP', 'CD8B', 'CD8A', 'SELL', 'SDC1', 'ESAM', 'SDC2', 'CDH15', 'HLA-DRB4', 'HLA-DRB3', 'HLA-DRB1', 'CD276', 'CD274', 'ICAM3', 'F11R', 'ICAM1', 'ICAM2', 'ALCAM', 'LRRC4B', 'CD99', 'LRRC4C', 'ITGA4', 'PDCD1LG2', 'CLDN11', 'PTPRF', 'VCAN', 'CLDN10', 'PTPRC', 'CLDN16', 'SIGLEC1', 'CLDN15', 'CLDN14', 'HLA-DQB1', 'HLA-DRA', 'ITGA9', 'CD28', 'CLDN19', 'ITGA8', 'PECAM1', 'CLDN18', 'CLDN17', 'ITGA6', 'CD22', 'CNTNAP2', 'NLGN2', 'CD40', 'CNTNAP1', 'NLGN3', 'NCAM1', 'NLGN1', 'NRXN2', 'SDC3', 'NRXN1', 'SDC4', 'PTPRM', 'LRRC4', 'NRXN3', 'CD99L2', 'GLG1', 'SPN', 'MADCAM1', 'MPZL1', 'CTLA4', 'NCAM2', 'CD34', 'HLA-DQA2', 'HLA-DQA1', 'ICOS', 'NLGN4X', 'NLGN4Y', 'NEGR1', 'CLDN34', 'CLDN7', 'CLDN6', 'CLDN5', 'CLDN4', 'NFASC', 'CLDN9', 'CLDN8', 'NECTIN1', 'HLA-DPB1', 'CD226', 'CD40LG', 'NECTIN3', 'NECTIN2', 'ITGB2', 'ITGB1', 'SELPLG', 'ITGAM', 'ITGAL', 'VSIR', 'CLDN23', 'CLDN22', 'HLA-DMB', 'CLDN20', 'CLDN25', 'CLDN24', 'HLA-DPA1', 'ITGB8', 'ITGAV', 'ITGB7', 'NRCAM', 'CD58', 'NEO1', 'HLA-DMA', 'TIGIT', 'ICOSLG']	148	6.864864864864865	0.722972972972973	0.277027027027027
