Pathway	Count	Length	Genes	GeneList	GeneCount	AvgGeneFrequency	SharedGeneFraction	UniqueGeneFraction
Neuroactive ligand-receptor interaction	1	341	TRHR, TAAR9, NPFF, TAAR8, TAAR5, TAAR6, CCK, GRIN2D, TAAR1, GRIN2C, PDYN, TAAR2, APLN, HTR5A, GRIN3A, SST, GRIN3B, LPAR6, LEP, AGTR2, AGTR1, VIP, PRSS2, SCT, VIPR2, PRSS1, VIPR1, C3AR1, PTH2, NTSR1, GPR156, PRSS3, NTSR2, PTGDR, PARD3, AVPR1A, NMBR, AVPR1B, MC1R, CCKBR, PTGFR, CRHR1, NPFFR1, NPFFR2, OXTR, LHB, LPAR2, LPAR3, LPAR4, RXFP1, ADCYAP1R1, GRPR, HTR6, RXFP2, CRHR2, RXFP3, C3, HTR4, LPAR1, RXFP4, GHRHR, C5, GRIN2B, HTR7, GRIN2A, GALR3, GALR2, GALR1, PPY, CGA, GABRA3, EDN1, GABRA2, EDN2, GABBR2, GABRA1, EDN3, GABBR1, NMB, GABRA6, GABRA5, FSHB, GABRA4, TACR3, TACR1, TACR2, MC3R, NMU, NPY4R2, FSHR, GNRH2, GNRH1, GABRB3, GABRB2, GIPR, GABRB1, OPRD1, FPR2, GRIK4, PRL, ADM, ADRB1, FPR1, GRIK5, ADRB2, GRIK2, PTH1R, ADRB3, FPR3, GRIK3, GRIK1, MLN, BRS3, GABRR3, MC2R, GABRR2, GABRR1, CCKAR, PENK, GNRHR, CTSG, HCRT, P2RY13, P2RY14, P2RY11, GPR35, GCGR, F2, SCTR, P2RY10, PTH2R, SLURP2, SLURP1, GAL, MAS1, MC5R, GHRH, F2RL1, F2RL2, AVP, GHRL, F2RL3, NPB, PTH, PTGER1, GRP, PTGER2, PTAFR, PTGER3, PTGER4, CHRND, GLRA1, CHRNE, GLRA2, GLRA3, NPW, UCN3, UCN2, CHRNG, MC4R, NPY, CHRNA10, TSPO, GABRE, GABRD, CHRNB3, CHRNB2, GABRQ, GABRP, PRLR, CHRNB4, NPY1R, TRPV1, GCG, AGT, GPR50, GRIN1, MTNR1B, MTNR1A, IAPP, LTB4R2, APLNR, UTS2, CHRNB1, CHRM3, CHRNA2, CHRM4, CHRNA1, CHRM1, CHRNA4, CHRM2, CHRNA3, CHRNA6, CHRNA5, CHRM5, CHRNA7, CHRNA9, CYSLTR2, CYSLTR1, PRLH, S1PR2, ADORA3, KISS1R, S1PR1, S1PR4, ADORA1, S1PR3, S1PR5, GHSR, F2R, ADRA2C, ADRA2B, ADRA2A, RLN3, NMUR2, RLN1, NMUR1, RLN2, GRIA2, GRIA3, CALCB, CALCRL, GRIA1, C5AR1, PMCH, CALCA, CSH2, CSH1, MCHR1, GPR83, MCHR2, NTS, CALCR, LEPR, GRIA4, NPY5R, HTR1F, AVPR2, HTR1D, HTR1E, HTR1B, OPRM1, SSTR1, HTR1A, SSTR2, SSTR3, SSTR4, GH1, PYY, SSTR5, GH2, KISS1, ADORA2B, ADORA2A, UCN, LTB4R, NPY4R, GLP1R, HTR2C, TRH, HTR2A, ADRA1D, HTR2B, OPRL1, OXT, ADRA1B, ADRA1A, KNG1, GHR, P2RY8, HRH2, HRH1, P2RY6, HRH4, TBXA2R, HRH3, NPBWR1, P2RY4, BDKRB1, NPBWR2, P2RY2, P2RY1, BDKRB2, DRD1, TAC4, DRD2, TAC3, DRD3, DRD4, TAC1, DRD5, PRLHR, LHCGR, GRID1, GRID2, PTGIR, GLP2R, UTS2R, GZMA, GABRG1, HCRTR1, OPRK1, GIP, GABRG3, GABRG2, HCRTR2, TSHR, ADCYAP1, P2RX7, POMC, CORT, P2RX6, P2RX5, P2RX4, GLRB, P2RX3, P2RX2, UTS2B, P2RX1, CRH, THRB, THRA, MLNR, NPY2R, PLG, NR3C1, GRM2, GRM1, GRM4, EDNRA, GRM3, EDNRB, GRM6, GRM5, GRM8, CNR2, GRM7, CNR1, INSL3, INSL5, TSHB	['TRHR', 'TAAR9', 'NPFF', 'TAAR8', 'TAAR5', 'TAAR6', 'CCK', 'GRIN2D', 'TAAR1', 'GRIN2C', 'PDYN', 'TAAR2', 'APLN', 'HTR5A', 'GRIN3A', 'SST', 'GRIN3B', 'LPAR6', 'LEP', 'AGTR2', 'AGTR1', 'VIP', 'PRSS2', 'SCT', 'VIPR2', 'PRSS1', 'VIPR1', 'C3AR1', 'PTH2', 'NTSR1', 'GPR156', 'PRSS3', 'NTSR2', 'PTGDR', 'PARD3', 'AVPR1A', 'NMBR', 'AVPR1B', 'MC1R', 'CCKBR', 'PTGFR', 'CRHR1', 'NPFFR1', 'NPFFR2', 'OXTR', 'LHB', 'LPAR2', 'LPAR3', 'LPAR4', 'RXFP1', 'ADCYAP1R1', 'GRPR', 'HTR6', 'RXFP2', 'CRHR2', 'RXFP3', 'C3', 'HTR4', 'LPAR1', 'RXFP4', 'GHRHR', 'C5', 'GRIN2B', 'HTR7', 'GRIN2A', 'GALR3', 'GALR2', 'GALR1', 'PPY', 'CGA', 'GABRA3', 'EDN1', 'GABRA2', 'EDN2', 'GABBR2', 'GABRA1', 'EDN3', 'GABBR1', 'NMB', 'GABRA6', 'GABRA5', 'FSHB', 'GABRA4', 'TACR3', 'TACR1', 'TACR2', 'MC3R', 'NMU', 'NPY4R2', 'FSHR', 'GNRH2', 'GNRH1', 'GABRB3', 'GABRB2', 'GIPR', 'GABRB1', 'OPRD1', 'FPR2', 'GRIK4', 'PRL', 'ADM', 'ADRB1', 'FPR1', 'GRIK5', 'ADRB2', 'GRIK2', 'PTH1R', 'ADRB3', 'FPR3', 'GRIK3', 'GRIK1', 'MLN', 'BRS3', 'GABRR3', 'MC2R', 'GABRR2', 'GABRR1', 'CCKAR', 'PENK', 'GNRHR', 'CTSG', 'HCRT', 'P2RY13', 'P2RY14', 'P2RY11', 'GPR35', 'GCGR', 'F2', 'SCTR', 'P2RY10', 'PTH2R', 'SLURP2', 'SLURP1', 'GAL', 'MAS1', 'MC5R', 'GHRH', 'F2RL1', 'F2RL2', 'AVP', 'GHRL', 'F2RL3', 'NPB', 'PTH', 'PTGER1', 'GRP', 'PTGER2', 'PTAFR', 'PTGER3', 'PTGER4', 'CHRND', 'GLRA1', 'CHRNE', 'GLRA2', 'GLRA3', 'NPW', 'UCN3', 'UCN2', 'CHRNG', 'MC4R', 'NPY', 'CHRNA10', 'TSPO', 'GABRE', 'GABRD', 'CHRNB3', 'CHRNB2', 'GABRQ', 'GABRP', 'PRLR', 'CHRNB4', 'NPY1R', 'TRPV1', 'GCG', 'AGT', 'GPR50', 'GRIN1', 'MTNR1B', 'MTNR1A', 'IAPP', 'LTB4R2', 'APLNR', 'UTS2', 'CHRNB1', 'CHRM3', 'CHRNA2', 'CHRM4', 'CHRNA1', 'CHRM1', 'CHRNA4', 'CHRM2', 'CHRNA3', 'CHRNA6', 'CHRNA5', 'CHRM5', 'CHRNA7', 'CHRNA9', 'CYSLTR2', 'CYSLTR1', 'PRLH', 'S1PR2', 'ADORA3', 'KISS1R', 'S1PR1', 'S1PR4', 'ADORA1', 'S1PR3', 'S1PR5', 'GHSR', 'F2R', 'ADRA2C', 'ADRA2B', 'ADRA2A', 'RLN3', 'NMUR2', 'RLN1', 'NMUR1', 'RLN2', 'GRIA2', 'GRIA3', 'CALCB', 'CALCRL', 'GRIA1', 'C5AR1', 'PMCH', 'CALCA', 'CSH2', 'CSH1', 'MCHR1', 'GPR83', 'MCHR2', 'NTS', 'CALCR', 'LEPR', 'GRIA4', 'NPY5R', 'HTR1F', 'AVPR2', 'HTR1D', 'HTR1E', 'HTR1B', 'OPRM1', 'SSTR1', 'HTR1A', 'SSTR2', 'SSTR3', 'SSTR4', 'GH1', 'PYY', 'SSTR5', 'GH2', 'KISS1', 'ADORA2B', 'ADORA2A', 'UCN', 'LTB4R', 'NPY4R', 'GLP1R', 'HTR2C', 'TRH', 'HTR2A', 'ADRA1D', 'HTR2B', 'OPRL1', 'OXT', 'ADRA1B', 'ADRA1A', 'KNG1', 'GHR', 'P2RY8', 'HRH2', 'HRH1', 'P2RY6', 'HRH4', 'TBXA2R', 'HRH3', 'NPBWR1', 'P2RY4', 'BDKRB1', 'NPBWR2', 'P2RY2', 'P2RY1', 'BDKRB2', 'DRD1', 'TAC4', 'DRD2', 'TAC3', 'DRD3', 'DRD4', 'TAC1', 'DRD5', 'PRLHR', 'LHCGR', 'GRID1', 'GRID2', 'PTGIR', 'GLP2R', 'UTS2R', 'GZMA', 'GABRG1', 'HCRTR1', 'OPRK1', 'GIP', 'GABRG3', 'GABRG2', 'HCRTR2', 'TSHR', 'ADCYAP1', 'P2RX7', 'POMC', 'CORT', 'P2RX6', 'P2RX5', 'P2RX4', 'GLRB', 'P2RX3', 'P2RX2', 'UTS2B', 'P2RX1', 'CRH', 'THRB', 'THRA', 'MLNR', 'NPY2R', 'PLG', 'NR3C1', 'GRM2', 'GRM1', 'GRM4', 'EDNRA', 'GRM3', 'EDNRB', 'GRM6', 'GRM5', 'GRM8', 'CNR2', 'GRM7', 'CNR1', 'INSL3', 'INSL5', 'TSHB']	341	3.6832844574780057	0.718475073313783	0.281524926686217
Thyroid hormone synthesis	1	75	GPX1, GPX3, GPX2, GPX5, GSR, HSPA5, GPX7, GPX6, GPX8, ATP1B4, ATP1B3, ATP1B2, ATP1B1, TG, PAX8, ALB, FXYD2, SLC26A4, ATF2, ADCY1, LRP2, ATF6B, ADCY5, ITPR2, ADCY4, ATP1A4, ITPR3, ADCY3, ATP1A3, ADCY2, ATP1A2, ADCY9, ATP1A1, SERPINA7, ADCY8, ADCY7, HSP90B1, SLC5A5, ADCY6, ITPR1, DUOX1, CREB3L1, DUOX2, IYD, CREB3L4, CREB3L2, DUOXA2, CREB3L3, PDIA4, PRKCG, PRKCB, PRKCA, TSHR, CREB3, CREB1, PLCB4, GNAQ, CANX, GNAS, PLCB2, PLCB3, ATF4, CREB5, PLCB1, ASGR1, TTF2, TTF1, ASGR2, TTR, PRKACG, TPO, PRKACB, CGA, PRKACA, TSHB	['GPX1', 'GPX3', 'GPX2', 'GPX5', 'GSR', 'HSPA5', 'GPX7', 'GPX6', 'GPX8', 'ATP1B4', 'ATP1B3', 'ATP1B2', 'ATP1B1', 'TG', 'PAX8', 'ALB', 'FXYD2', 'SLC26A4', 'ATF2', 'ADCY1', 'LRP2', 'ATF6B', 'ADCY5', 'ITPR2', 'ADCY4', 'ATP1A4', 'ITPR3', 'ADCY3', 'ATP1A3', 'ADCY2', 'ATP1A2', 'ADCY9', 'ATP1A1', 'SERPINA7', 'ADCY8', 'ADCY7', 'HSP90B1', 'SLC5A5', 'ADCY6', 'ITPR1', 'DUOX1', 'CREB3L1', 'DUOX2', 'IYD', 'CREB3L4', 'CREB3L2', 'DUOXA2', 'CREB3L3', 'PDIA4', 'PRKCG', 'PRKCB', 'PRKCA', 'TSHR', 'CREB3', 'CREB1', 'PLCB4', 'GNAQ', 'CANX', 'GNAS', 'PLCB2', 'PLCB3', 'ATF4', 'CREB5', 'PLCB1', 'ASGR1', 'TTF2', 'TTF1', 'ASGR2', 'TTR', 'PRKACG', 'TPO', 'PRKACB', 'CGA', 'PRKACA', 'TSHB']	75	25.92	0.8266666666666667	0.17333333333333334
Regulation of lipolysis in adipocytes	1	55	NPY1R, PIK3CB, PIK3CA, PDE3B, MGLL, ABHD5, ADCY1, NPR1, ADCY5, AQP7, ADCY4, ADRB1, ADCY3, ADRB2, PIK3R3, ADCY2, ADRB3, PIK3R2, ADCY9, ADCY8, ADCY7, ADCY6, AKT3, AKT1, AKT2, ADORA1, PRKG2, PRKG1, INSR, PLIN1, PLAAT3, TSHR, FABP4, PIK3R1, GNAS, PNPLA2, IRS1, IRS2, PTGER3, PIK3CD, IRS4, INS, GNAI1, GNAI2, PTGS1, GNAI3, PTGS2, PRKACG, LIPE, NPPA, NPY, PRKACB, CGA, PRKACA, TSHB	['NPY1R', 'PIK3CB', 'PIK3CA', 'PDE3B', 'MGLL', 'ABHD5', 'ADCY1', 'NPR1', 'ADCY5', 'AQP7', 'ADCY4', 'ADRB1', 'ADCY3', 'ADRB2', 'PIK3R3', 'ADCY2', 'ADRB3', 'PIK3R2', 'ADCY9', 'ADCY8', 'ADCY7', 'ADCY6', 'AKT3', 'AKT1', 'AKT2', 'ADORA1', 'PRKG2', 'PRKG1', 'INSR', 'PLIN1', 'PLAAT3', 'TSHR', 'FABP4', 'PIK3R1', 'GNAS', 'PNPLA2', 'IRS1', 'IRS2', 'PTGER3', 'PIK3CD', 'IRS4', 'INS', 'GNAI1', 'GNAI2', 'PTGS1', 'GNAI3', 'PTGS2', 'PRKACG', 'LIPE', 'NPPA', 'NPY', 'PRKACB', 'CGA', 'PRKACA', 'TSHB']	55	35.54545454545455	0.9818181818181818	0.018181818181818188
Aminoacyl-tRNA biosynthesis	2	66	HARS2, RARS1, HARS1, RARS2, QARS1, SARS1, GARS1, SARS2, PARS2, TARS3, TARS1, TARS2, AARS2, YARS1, KARS1, TRNS2, TRNS1, YARS2, IARS1, IARS2, AARS1, MARS1, TRNW, TRNV, TRNT, GATB, TRNR, MARS2, TRNQ, GATC, QRSL1, WARS1, DARS2, WARS2, DARS1, TRNY, TRNL1, TRNL2, EPRS1, LARS2, LARS1, CARS2, FARSB, FARSA, CARS1, MTFMT, FARS2, SEPSECS, TRNH, TRNG, TRNF, TRNE, NARS2, TRND, NARS1, TRNC, TRNA, TRNP, TRNN, TRNM, PSTK, TRNK, VARS1, EARS2, TRNI, VARS2	['HARS2', 'RARS1', 'HARS1', 'RARS2', 'QARS1', 'SARS1', 'GARS1', 'SARS2', 'PARS2', 'TARS3', 'TARS1', 'TARS2', 'AARS2', 'YARS1', 'KARS1', 'TRNS2', 'TRNS1', 'YARS2', 'IARS1', 'IARS2', 'AARS1', 'MARS1', 'TRNW', 'TRNV', 'TRNT', 'GATB', 'TRNR', 'MARS2', 'TRNQ', 'GATC', 'QRSL1', 'WARS1', 'DARS2', 'WARS2', 'DARS1', 'TRNY', 'TRNL1', 'TRNL2', 'EPRS1', 'LARS2', 'LARS1', 'CARS2', 'FARSB', 'FARSA', 'CARS1', 'MTFMT', 'FARS2', 'SEPSECS', 'TRNH', 'TRNG', 'TRNF', 'TRNE', 'NARS2', 'TRND', 'NARS1', 'TRNC', 'TRNA', 'TRNP', 'TRNN', 'TRNM', 'PSTK', 'TRNK', 'VARS1', 'EARS2', 'TRNI', 'VARS2']	66	1.106060606060606	0.10606060606060606	0.8939393939393939
Neurotrophin signaling pathway	2	119	MAP3K3, MAP3K1, BAD, MATK, FRS2, MAPK13, MAPK14, MAPK11, MAPK12, MAPK10, MAPKAPK2, BAX, CALM2, CALM3, TP53, CALM1, RAF1, RELA, ZNF274, CALML6, PRDM4, CALML3, CALML4, CALML5, FOXO3, CRKL, NRAS, AKT3, NTF3, NTF4, AKT1, SH2B1, AKT2, MAP3K5, SH2B3, SH2B2, NGFR, MAP2K5, MAP2K2, PRKCD, MAP2K1, NFKB1, TP73, PIK3R1, TRAF6, GRB2, ATF4, BEX3, IRS1, MAGED1, PSEN1, FASLG, PSEN2, PLCG1, ABL1, PLCG2, MAP2K7, RHOA, JUN, BDNF, GAB1, PTPN11, IRAK4, BRAF, NFKBIB, NFKBIA, PIK3CB, PIK3CA, BCL2, CAMK4, RAPGEF1, SOS2, NFKBIE, SOS1, GSK3B, SHC3, SHC4, YWHAE, SHC1, SHC2, PIK3R3, PIK3R2, RAP1A, RAP1B, IRAK2, IRAK3, IRAK1, RIPK2, NTRK2, NTRK3, NTRK1, SORT1, PDPK1, KIDINS220, NGF, CDC42, CRK, KRAS, CAMK2D, CAMK2A, CAMK2B, PIK3CD, ARHGDIG, RPS6KA5, ARHGDIA, IKBKB, MAPK9, MAPK8, RPS6KA6, RPS6KA1, ARHGDIB, RPS6KA3, RPS6KA2, MAPK3, HRAS, MAPK1, RAC1, CAMK2G, MAPK7	['MAP3K3', 'MAP3K1', 'BAD', 'MATK', 'FRS2', 'MAPK13', 'MAPK14', 'MAPK11', 'MAPK12', 'MAPK10', 'MAPKAPK2', 'BAX', 'CALM2', 'CALM3', 'TP53', 'CALM1', 'RAF1', 'RELA', 'ZNF274', 'CALML6', 'PRDM4', 'CALML3', 'CALML4', 'CALML5', 'FOXO3', 'CRKL', 'NRAS', 'AKT3', 'NTF3', 'NTF4', 'AKT1', 'SH2B1', 'AKT2', 'MAP3K5', 'SH2B3', 'SH2B2', 'NGFR', 'MAP2K5', 'MAP2K2', 'PRKCD', 'MAP2K1', 'NFKB1', 'TP73', 'PIK3R1', 'TRAF6', 'GRB2', 'ATF4', 'BEX3', 'IRS1', 'MAGED1', 'PSEN1', 'FASLG', 'PSEN2', 'PLCG1', 'ABL1', 'PLCG2', 'MAP2K7', 'RHOA', 'JUN', 'BDNF', 'GAB1', 'PTPN11', 'IRAK4', 'BRAF', 'NFKBIB', 'NFKBIA', 'PIK3CB', 'PIK3CA', 'BCL2', 'CAMK4', 'RAPGEF1', 'SOS2', 'NFKBIE', 'SOS1', 'GSK3B', 'SHC3', 'SHC4', 'YWHAE', 'SHC1', 'SHC2', 'PIK3R3', 'PIK3R2', 'RAP1A', 'RAP1B', 'IRAK2', 'IRAK3', 'IRAK1', 'RIPK2', 'NTRK2', 'NTRK3', 'NTRK1', 'SORT1', 'PDPK1', 'KIDINS220', 'NGF', 'CDC42', 'CRK', 'KRAS', 'CAMK2D', 'CAMK2A', 'CAMK2B', 'PIK3CD', 'ARHGDIG', 'RPS6KA5', 'ARHGDIA', 'IKBKB', 'MAPK9', 'MAPK8', 'RPS6KA6', 'RPS6KA1', 'ARHGDIB', 'RPS6KA3', 'RPS6KA2', 'MAPK3', 'HRAS', 'MAPK1', 'RAC1', 'CAMK2G', 'MAPK7']	119	33.79831932773109	0.9243697478991597	0.07563025210084029
Inflammatory mediator regulation of TRP channels	1	98	IL1R1, TRPV3, TRPV4, TRPV1, TRPV2, MAPK13, PPP1CA, MAPK14, PPP1CB, MAPK11, MAPK12, MAPK10, CALM2, CALM3, CALM1, ADCY1, CALML6, ADCY5, ADCY4, CALML3, ADCY3, CALML4, IL1RAP, ADCY2, CALML5, ADCY9, ADCY8, ADCY7, ADCY6, PPP1CC, PRKCH, PRKCG, MAP2K3, PLA2G4E, PRKCD, PLA2G4F, PLA2G4C, PLA2G4D, PRKCE, PLA2G4A, PLA2G4B, IGF1, PRKCB, PRKCA, PIK3R1, GNAQ, GNAS, PRKCQ, PLA2G6, PRKACG, PLCG1, TRPM8, PLCG2, PRKACB, MAP2K6, CYP2J2, PRKACA, TRPA1, IL1B, PIK3CB, PIK3CA, HTR2C, ITPR2, ITPR3, HTR2A, PIK3R3, ALOX12, HTR2B, PIK3R2, ITPR1, KNG1, ASIC5, HRH1, BDKRB1, P2RY2, BDKRB2, ASIC3, ASIC4, ASIC1, ASIC2, NTRK1, NGF, PLCB4, JMJD7-PLA2G4B, F2RL1, PLCB2, PLCB3, PLCB1, CAMK2D, SRC, PTGER2, CAMK2A, CAMK2B, PTGER4, PIK3CD, MAPK9, MAPK8, CAMK2G	['IL1R1', 'TRPV3', 'TRPV4', 'TRPV1', 'TRPV2', 'MAPK13', 'PPP1CA', 'MAPK14', 'PPP1CB', 'MAPK11', 'MAPK12', 'MAPK10', 'CALM2', 'CALM3', 'CALM1', 'ADCY1', 'CALML6', 'ADCY5', 'ADCY4', 'CALML3', 'ADCY3', 'CALML4', 'IL1RAP', 'ADCY2', 'CALML5', 'ADCY9', 'ADCY8', 'ADCY7', 'ADCY6', 'PPP1CC', 'PRKCH', 'PRKCG', 'MAP2K3', 'PLA2G4E', 'PRKCD', 'PLA2G4F', 'PLA2G4C', 'PLA2G4D', 'PRKCE', 'PLA2G4A', 'PLA2G4B', 'IGF1', 'PRKCB', 'PRKCA', 'PIK3R1', 'GNAQ', 'GNAS', 'PRKCQ', 'PLA2G6', 'PRKACG', 'PLCG1', 'TRPM8', 'PLCG2', 'PRKACB', 'MAP2K6', 'CYP2J2', 'PRKACA', 'TRPA1', 'IL1B', 'PIK3CB', 'PIK3CA', 'HTR2C', 'ITPR2', 'ITPR3', 'HTR2A', 'PIK3R3', 'ALOX12', 'HTR2B', 'PIK3R2', 'ITPR1', 'KNG1', 'ASIC5', 'HRH1', 'BDKRB1', 'P2RY2', 'BDKRB2', 'ASIC3', 'ASIC4', 'ASIC1', 'ASIC2', 'NTRK1', 'NGF', 'PLCB4', 'JMJD7-PLA2G4B', 'F2RL1', 'PLCB2', 'PLCB3', 'PLCB1', 'CAMK2D', 'SRC', 'PTGER2', 'CAMK2A', 'CAMK2B', 'PTGER4', 'PIK3CD', 'MAPK9', 'MAPK8', 'CAMK2G']	98	34.89795918367347	0.9285714285714286	0.0714285714285714
Glycerophospholipid metabolism	1	98	CRLS1, PISD, ETNPPL, PHOSPHO1, ADPRM, GPD1, GPD2, GPD1L, DGKH, DGKG, DGKE, DGKD, DGKB, DGKA, LCAT, LCLAT1, SELENOI, PCYT1A, PCYT1B, PCYT2, PLA2G4E, PLA2G4F, PLA2G4C, PLA2G4D, PLA2G4A, PLA2G4B, PLAAT3, DGKZ, PLPP5, GNPAT, DGKQ, PLPP4, DGKK, PLPP3, PEMT, PLA1A, PLPP2, DGKI, PLPP1, CDS2, CDS1, LPGAT1, CHAT, PLA2G3, PLA2G5, PLA2G6, PLB1, PTDSS2, PTDSS1, LYPLA2, PLA2G2E, LYPLA1, PLA2G2F, CHKB, PLA2G2C, CHKA, PLA2G2D, PLA2G2A, GPCPD1, LPIN1, CHPT1, LPIN2, LPIN3, ACHE, AGPAT1, AGPAT2, PLD2, AGPAT3, PLD1, TAZ, AGPAT4, PLD4, AGPAT5, PLD3, PGS1, PLA2G12A, PLA2G12B, MBOAT7, MBOAT2, MBOAT1, PLA2G15, GPAM, ETNK2, LPCAT4, PLA2G10, ETNK1, JMJD7-PLA2G4B, LPCAT3, PNPLA6, PNPLA7, PLA2G1B, LPCAT2, LPCAT1, GPAT2, CEPT1, GPAT4, CDIPT, GPAT3	['CRLS1', 'PISD', 'ETNPPL', 'PHOSPHO1', 'ADPRM', 'GPD1', 'GPD2', 'GPD1L', 'DGKH', 'DGKG', 'DGKE', 'DGKD', 'DGKB', 'DGKA', 'LCAT', 'LCLAT1', 'SELENOI', 'PCYT1A', 'PCYT1B', 'PCYT2', 'PLA2G4E', 'PLA2G4F', 'PLA2G4C', 'PLA2G4D', 'PLA2G4A', 'PLA2G4B', 'PLAAT3', 'DGKZ', 'PLPP5', 'GNPAT', 'DGKQ', 'PLPP4', 'DGKK', 'PLPP3', 'PEMT', 'PLA1A', 'PLPP2', 'DGKI', 'PLPP1', 'CDS2', 'CDS1', 'LPGAT1', 'CHAT', 'PLA2G3', 'PLA2G5', 'PLA2G6', 'PLB1', 'PTDSS2', 'PTDSS1', 'LYPLA2', 'PLA2G2E', 'LYPLA1', 'PLA2G2F', 'CHKB', 'PLA2G2C', 'CHKA', 'PLA2G2D', 'PLA2G2A', 'GPCPD1', 'LPIN1', 'CHPT1', 'LPIN2', 'LPIN3', 'ACHE', 'AGPAT1', 'AGPAT2', 'PLD2', 'AGPAT3', 'PLD1', 'TAZ', 'AGPAT4', 'PLD4', 'AGPAT5', 'PLD3', 'PGS1', 'PLA2G12A', 'PLA2G12B', 'MBOAT7', 'MBOAT2', 'MBOAT1', 'PLA2G15', 'GPAM', 'ETNK2', 'LPCAT4', 'PLA2G10', 'ETNK1', 'JMJD7-PLA2G4B', 'LPCAT3', 'PNPLA6', 'PNPLA7', 'PLA2G1B', 'LPCAT2', 'LPCAT1', 'GPAT2', 'CEPT1', 'GPAT4', 'CDIPT', 'GPAT3']	98	5.091836734693878	0.8061224489795918	0.19387755102040816
Purine metabolism	6	129	ENTPD1, ENTPD2, GUCY1A2, ENTPD3, GUCY1A1, ENTPD4, ENTPD5, PDE6H, ENTPD6, PDE6G, ENTPD8, ADPRM, PDE7B, PDE7A, ADCY10, ALLC, HDDC3, GDA, ADCY1, ADCY5, ADCY4, PRUNE1, ADCY3, NTPCR, ADCY2, ADCY9, PAPSS1, ADCY8, ADCY7, ADCY6, PAPSS2, PNP, NT5E, NT5C, NT5M, PDE8B, PDE8A, NT5C3B, NT5C3A, ADSS1, ITPA, ADSS2, HPRT1, NT5C1B-RDH14, PDE9A, GUCY1B1, PDE1C, AK1, PDE1B, AK2, PDE1A, AK3, AK4, AK5, AK6, AK7, AK8, AK9, DGUOK, NME1-NME2, PPAT, PDE2A, PAICS, AMPD1, NME3, AMPD2, NME4, AMPD3, NME6, ADA2, NME1, NME2, NT5C1A, NME7, RRM2B, NT5C1B, PDE3B, PDE3A, GART, ADA, GUCY2D, GUCY2C, GUCY2F, NPR1, NPR2, GMPR, ADK, GMPS, FHIT, PDE11A, NT5C2, ATIC, PDE4C, URAD, PDE4B, PDE4A, PRPS1L1, RRM2, ADSL, PKLR, RRM1, PDE4D, DCK, APRT, PKM, PDE10A, NUDT9, IMPDH1, IMPDH2, PDE5A, PRPS2, CANT1, PFAS, GMPR2, PRPS1, NUDT2, NUDT5, GUK1, ENPP1, ENPP3, PDE6D, PDE6C, XDH, ENPP4, PDE6B, NUDT16, PDE6A, PGM2, PGM1	['ENTPD1', 'ENTPD2', 'GUCY1A2', 'ENTPD3', 'GUCY1A1', 'ENTPD4', 'ENTPD5', 'PDE6H', 'ENTPD6', 'PDE6G', 'ENTPD8', 'ADPRM', 'PDE7B', 'PDE7A', 'ADCY10', 'ALLC', 'HDDC3', 'GDA', 'ADCY1', 'ADCY5', 'ADCY4', 'PRUNE1', 'ADCY3', 'NTPCR', 'ADCY2', 'ADCY9', 'PAPSS1', 'ADCY8', 'ADCY7', 'ADCY6', 'PAPSS2', 'PNP', 'NT5E', 'NT5C', 'NT5M', 'PDE8B', 'PDE8A', 'NT5C3B', 'NT5C3A', 'ADSS1', 'ITPA', 'ADSS2', 'HPRT1', 'NT5C1B-RDH14', 'PDE9A', 'GUCY1B1', 'PDE1C', 'AK1', 'PDE1B', 'AK2', 'PDE1A', 'AK3', 'AK4', 'AK5', 'AK6', 'AK7', 'AK8', 'AK9', 'DGUOK', 'NME1-NME2', 'PPAT', 'PDE2A', 'PAICS', 'AMPD1', 'NME3', 'AMPD2', 'NME4', 'AMPD3', 'NME6', 'ADA2', 'NME1', 'NME2', 'NT5C1A', 'NME7', 'RRM2B', 'NT5C1B', 'PDE3B', 'PDE3A', 'GART', 'ADA', 'GUCY2D', 'GUCY2C', 'GUCY2F', 'NPR1', 'NPR2', 'GMPR', 'ADK', 'GMPS', 'FHIT', 'PDE11A', 'NT5C2', 'ATIC', 'PDE4C', 'URAD', 'PDE4B', 'PDE4A', 'PRPS1L1', 'RRM2', 'ADSL', 'PKLR', 'RRM1', 'PDE4D', 'DCK', 'APRT', 'PKM', 'PDE10A', 'NUDT9', 'IMPDH1', 'IMPDH2', 'PDE5A', 'PRPS2', 'CANT1', 'PFAS', 'GMPR2', 'PRPS1', 'NUDT2', 'NUDT5', 'GUK1', 'ENPP1', 'ENPP3', 'PDE6D', 'PDE6C', 'XDH', 'ENPP4', 'PDE6B', 'NUDT16', 'PDE6A', 'PGM2', 'PGM1']	129	6.10077519379845	0.7984496124031008	0.20155038759689925
Lysosome	1	128	CD164, ENTPD4, AP1S1, AP1B1, CTNS, GALNS, GLA, CD68, ATP6V0D1, IDUA, ASAH1, GGA1, GGA3, AP3M2, GGA2, LAPTM4B, GNPTAB, LAPTM4A, LAMP2, LAMP1, LAMP3, AP3M1, ABCA2, ARSA, ARSB, IGF2R, ATP6V0C, PSAPL1, ATP6V0B, MANBA, NAPSA, DNASE2B, ATP6AP1, SLC11A1, SLC11A2, M6PR, AP4B1, LGMN, PPT2, PPT1, TPP1, GNS, NAGPA, LIPA, AP1S3, AP1S2, ATP6V0A4, ARSG, ATP6V0A1, ATP6V1H, ATP6V0A2, CTSB, HGSNAT, CTSA, FUCA1, FUCA2, AP3B2, AP3B1, NPC1, SUMF1, SPAM1, NPC2, GNPTG, DNASE2, MAN2B1, CLTC, CTSZ, CLTB, ABCB9, CLTA, LITAF, CTSW, CTSV, CTSS, CTSO, MFSD8, PSAP, CLTCL1, CTSL, IDS, NEU1, CTSK, ACP5, CTSH, AP4S1, CTSG, AP1M1, CTSF, ACP2, CTSE, CTSD, AP1M2, CTSC, SORT1, GAA, NAGA, AP3D1, LAPTM5, MCOLN1, GALC, GLB1, PLA2G15, ATP6V0D2, SCARB2, CD63, GBA, HEXA, HEXB, TCIRG1, AP4E1, SGSH, CLN5, AP4M1, AP1G1, CLN3, HYAL1, AP1G2, GM2A, HYAL2, NAGLU, HYAL3, HYAL4, SMPD1, AP3S1, AGA, AP3S2, GUSB, SLC17A5	['CD164', 'ENTPD4', 'AP1S1', 'AP1B1', 'CTNS', 'GALNS', 'GLA', 'CD68', 'ATP6V0D1', 'IDUA', 'ASAH1', 'GGA1', 'GGA3', 'AP3M2', 'GGA2', 'LAPTM4B', 'GNPTAB', 'LAPTM4A', 'LAMP2', 'LAMP1', 'LAMP3', 'AP3M1', 'ABCA2', 'ARSA', 'ARSB', 'IGF2R', 'ATP6V0C', 'PSAPL1', 'ATP6V0B', 'MANBA', 'NAPSA', 'DNASE2B', 'ATP6AP1', 'SLC11A1', 'SLC11A2', 'M6PR', 'AP4B1', 'LGMN', 'PPT2', 'PPT1', 'TPP1', 'GNS', 'NAGPA', 'LIPA', 'AP1S3', 'AP1S2', 'ATP6V0A4', 'ARSG', 'ATP6V0A1', 'ATP6V1H', 'ATP6V0A2', 'CTSB', 'HGSNAT', 'CTSA', 'FUCA1', 'FUCA2', 'AP3B2', 'AP3B1', 'NPC1', 'SUMF1', 'SPAM1', 'NPC2', 'GNPTG', 'DNASE2', 'MAN2B1', 'CLTC', 'CTSZ', 'CLTB', 'ABCB9', 'CLTA', 'LITAF', 'CTSW', 'CTSV', 'CTSS', 'CTSO', 'MFSD8', 'PSAP', 'CLTCL1', 'CTSL', 'IDS', 'NEU1', 'CTSK', 'ACP5', 'CTSH', 'AP4S1', 'CTSG', 'AP1M1', 'CTSF', 'ACP2', 'CTSE', 'CTSD', 'AP1M2', 'CTSC', 'SORT1', 'GAA', 'NAGA', 'AP3D1', 'LAPTM5', 'MCOLN1', 'GALC', 'GLB1', 'PLA2G15', 'ATP6V0D2', 'SCARB2', 'CD63', 'GBA', 'HEXA', 'HEXB', 'TCIRG1', 'AP4E1', 'SGSH', 'CLN5', 'AP4M1', 'AP1G1', 'CLN3', 'HYAL1', 'AP1G2', 'GM2A', 'HYAL2', 'NAGLU', 'HYAL3', 'HYAL4', 'SMPD1', 'AP3S1', 'AGA', 'AP3S2', 'GUSB', 'SLC17A5']	128	2.921875	0.6953125	0.3046875
Inositol phosphate metabolism	1	73	MIOX, TPI1, PLCH1, IPMK, ITPK1, OCRL, ITPKC, ALDH6A1, PIK3CB, PIK3CA, PIKFYVE, ITPKA, ITPKB, PI4KB, PI4KA, PLCD1, PLCH2, PIK3C3, PLCD4, PI4K2B, PI4K2A, PLCD3, MTMR1, MTMR2, INPP1, MTMR3, IPPK, MTMR4, INPPL1, MTMR6, MTM1, MTMR7, MTMR8, PIP5KL1, PLCZ1, PIP4K2A, PLCE1, PIP4K2B, PIP4K2C, SACM1L, FIG4, INPP4B, MINPP1, PLCB4, INPP4A, SYNJ2, SYNJ1, PLCB2, PLCB3, PLCB1, ISYNA1, MTMR14, PTEN, PIK3CD, PIK3C2G, PIK3C2B, PIK3C2A, PIK3CG, INPP5D, INPP5A, IMPA1, INPP5B, IMPA2, INPP5E, INPP5F, INPP5K, PIP5K1A, PIP5K1B, PIP5K1C, PLCG1, CDIPT, INPP5J, PLCG2	['MIOX', 'TPI1', 'PLCH1', 'IPMK', 'ITPK1', 'OCRL', 'ITPKC', 'ALDH6A1', 'PIK3CB', 'PIK3CA', 'PIKFYVE', 'ITPKA', 'ITPKB', 'PI4KB', 'PI4KA', 'PLCD1', 'PLCH2', 'PIK3C3', 'PLCD4', 'PI4K2B', 'PI4K2A', 'PLCD3', 'MTMR1', 'MTMR2', 'INPP1', 'MTMR3', 'IPPK', 'MTMR4', 'INPPL1', 'MTMR6', 'MTM1', 'MTMR7', 'MTMR8', 'PIP5KL1', 'PLCZ1', 'PIP4K2A', 'PLCE1', 'PIP4K2B', 'PIP4K2C', 'SACM1L', 'FIG4', 'INPP4B', 'MINPP1', 'PLCB4', 'INPP4A', 'SYNJ2', 'SYNJ1', 'PLCB2', 'PLCB3', 'PLCB1', 'ISYNA1', 'MTMR14', 'PTEN', 'PIK3CD', 'PIK3C2G', 'PIK3C2B', 'PIK3C2A', 'PIK3CG', 'INPP5D', 'INPP5A', 'IMPA1', 'INPP5B', 'IMPA2', 'INPP5E', 'INPP5F', 'INPP5K', 'PIP5K1A', 'PIP5K1B', 'PIP5K1C', 'PLCG1', 'CDIPT', 'INPP5J', 'PLCG2']	73	11.794520547945206	0.9315068493150684	0.06849315068493156
Toll-like receptor signaling pathway	5	104	TICAM2, TICAM1, MAPK13, MAPK14, CXCL10, MAPK11, CXCL11, MAPK12, MAPK10, TOLLIP, CD86, RELA, CD80, TNF, AKT3, AKT1, AKT2, SPP1, MAP3K7, MAP3K8, MAP2K4, IFNA13, IFNA14, MAP2K2, MAP2K3, IFNA16, IFNA17, MAP2K1, TIRAP, TRAF3, NFKB1, MYD88, PIK3R1, TRAF6, TAB2, TAB1, IFNA10, IFNAR1, IFNAR2, CCL4L1, CCL4L2, TBK1, IL12B, IL12A, CD14, IFNA21, MAP2K6, MAP2K7, JUN, IRAK4, TLR2, IL1B, NFKBIA, TLR1, IL6, PIK3CB, IRF5, PIK3CA, IRF3, TLR9, TLR8, IRF7, TLR7, TLR6, TLR5, TLR4, TLR3, CXCL8, CCL3L1, CD40, CXCL9, CCL3L3, LY96, PIK3R3, PIK3R2, CASP8, CTSK, IRAK1, LBP, FADD, RIPK1, STAT1, CHUK, FOS, IFNA6, IFNA5, IFNA8, IFNA7, IFNA2, IFNA1, IFNA4, PIK3CD, IKBKB, MAPK9, MAPK8, CCL5, CCL4, MAPK3, CCL3, IFNB1, MAPK1, RAC1, IKBKG, IKBKE	['TICAM2', 'TICAM1', 'MAPK13', 'MAPK14', 'CXCL10', 'MAPK11', 'CXCL11', 'MAPK12', 'MAPK10', 'TOLLIP', 'CD86', 'RELA', 'CD80', 'TNF', 'AKT3', 'AKT1', 'AKT2', 'SPP1', 'MAP3K7', 'MAP3K8', 'MAP2K4', 'IFNA13', 'IFNA14', 'MAP2K2', 'MAP2K3', 'IFNA16', 'IFNA17', 'MAP2K1', 'TIRAP', 'TRAF3', 'NFKB1', 'MYD88', 'PIK3R1', 'TRAF6', 'TAB2', 'TAB1', 'IFNA10', 'IFNAR1', 'IFNAR2', 'CCL4L1', 'CCL4L2', 'TBK1', 'IL12B', 'IL12A', 'CD14', 'IFNA21', 'MAP2K6', 'MAP2K7', 'JUN', 'IRAK4', 'TLR2', 'IL1B', 'NFKBIA', 'TLR1', 'IL6', 'PIK3CB', 'IRF5', 'PIK3CA', 'IRF3', 'TLR9', 'TLR8', 'IRF7', 'TLR7', 'TLR6', 'TLR5', 'TLR4', 'TLR3', 'CXCL8', 'CCL3L1', 'CD40', 'CXCL9', 'CCL3L3', 'LY96', 'PIK3R3', 'PIK3R2', 'CASP8', 'CTSK', 'IRAK1', 'LBP', 'FADD', 'RIPK1', 'STAT1', 'CHUK', 'FOS', 'IFNA6', 'IFNA5', 'IFNA8', 'IFNA7', 'IFNA2', 'IFNA1', 'IFNA4', 'PIK3CD', 'IKBKB', 'MAPK9', 'MAPK8', 'CCL5', 'CCL4', 'MAPK3', 'CCL3', 'IFNB1', 'MAPK1', 'RAC1', 'IKBKG', 'IKBKE']	104	33.99038461538461	0.9807692307692307	0.019230769230769273
Protein processing in endoplasmic reticulum	3	171	SEC24A, SEC24C, SEC24B, HSPA1L, FBXO2, AMFR, MOGS, YOD1, RBX1, ERN1, NSFL1C, MAPK10, SELENOS, DNAJB11, DNAJB12, HSPA1A, BAX, RNF185, ERP29, PREB, SEC24D, PLAA, HSPA1B, PRKN, ATF6B, CRYAA2, TUSC3, UBE2D3, UBXN2A, PPP1R15A, UBE2D4, UBE2D1, UBE2D2, RRBP1, RNF5, HSP90B1, CAPN1, CAPN2, TRAM1L1, MAP3K5, PDIA4, PDIA3, XBP1, LMAN1L, WFS1, EDEM1, EDEM2, EDEM3, TRAF2, EIF2S1, PDIA6, CKAP4, NPLOC4, DDOST, DNAJC10, STT3B, HYOU1, STT3A, ATF6, CRYAB, ATF4, MMP24-AS1-EDEM2, CRYAA, HSPA4L, VCP, NGLY1, CUL1, SEL1L2, HSPBP1, UBE2J1, UBE2J2, HSPH1, ATXN3L, BAG1, BAG2, TXNDC5, SEC31A, SEC63, SIL1, SEC62, SKP1, MAP2K7, SEC31B, HSP90AA1, SEC13, HSPA6, HSPA5, EIF2AK2, HSPA8, SSR3, EIF2AK1, SSR4, EIF2AK4, HSPA2, EIF2AK3, RAD23B, UBE2G2, RAD23A, UBE2G1, DNAJC3, DNAJC1, DNAJC5, BCL2, CALR, NFE2L2, UBXN1, SAR1A, TRAM1, SAR1B, RPN1, SEL1L, RPN2, DNAJB2, ATXN3, DNAJB1, CASP12, ERLEC1, SEC61G, SEC61B, SSR1, DNAJC5G, SSR2, UBXN8, MAN1A2, MAN1A1, UBXN4, UBXN6, MBTPS1, MBTPS2, BCAP31, DNAJC5B, SYVN1, UBE4B, SVIP, DNAJA2, DNAJA1, DAD1, CANX, MAN1B1, P4HB, DDIT3, STUB1, ERO1B, SEC23B, ERO1A, SEC23A, HSP90AB1, PRKCSH, DERL2, DERL3, DERL1, HERPUD1, LMAN1, LMAN2, SEC61A2, MAPK9, GANAB, MAPK8, OS9, SEC61A1, UBQLN2, MAN1C1, UBQLN1, BAK1, UFD1, FBXO6, UGGT2, UBQLN4, UGGT1, MARCHF6, UBQLN3	['SEC24A', 'SEC24C', 'SEC24B', 'HSPA1L', 'FBXO2', 'AMFR', 'MOGS', 'YOD1', 'RBX1', 'ERN1', 'NSFL1C', 'MAPK10', 'SELENOS', 'DNAJB11', 'DNAJB12', 'HSPA1A', 'BAX', 'RNF185', 'ERP29', 'PREB', 'SEC24D', 'PLAA', 'HSPA1B', 'PRKN', 'ATF6B', 'CRYAA2', 'TUSC3', 'UBE2D3', 'UBXN2A', 'PPP1R15A', 'UBE2D4', 'UBE2D1', 'UBE2D2', 'RRBP1', 'RNF5', 'HSP90B1', 'CAPN1', 'CAPN2', 'TRAM1L1', 'MAP3K5', 'PDIA4', 'PDIA3', 'XBP1', 'LMAN1L', 'WFS1', 'EDEM1', 'EDEM2', 'EDEM3', 'TRAF2', 'EIF2S1', 'PDIA6', 'CKAP4', 'NPLOC4', 'DDOST', 'DNAJC10', 'STT3B', 'HYOU1', 'STT3A', 'ATF6', 'CRYAB', 'ATF4', 'MMP24-AS1-EDEM2', 'CRYAA', 'HSPA4L', 'VCP', 'NGLY1', 'CUL1', 'SEL1L2', 'HSPBP1', 'UBE2J1', 'UBE2J2', 'HSPH1', 'ATXN3L', 'BAG1', 'BAG2', 'TXNDC5', 'SEC31A', 'SEC63', 'SIL1', 'SEC62', 'SKP1', 'MAP2K7', 'SEC31B', 'HSP90AA1', 'SEC13', 'HSPA6', 'HSPA5', 'EIF2AK2', 'HSPA8', 'SSR3', 'EIF2AK1', 'SSR4', 'EIF2AK4', 'HSPA2', 'EIF2AK3', 'RAD23B', 'UBE2G2', 'RAD23A', 'UBE2G1', 'DNAJC3', 'DNAJC1', 'DNAJC5', 'BCL2', 'CALR', 'NFE2L2', 'UBXN1', 'SAR1A', 'TRAM1', 'SAR1B', 'RPN1', 'SEL1L', 'RPN2', 'DNAJB2', 'ATXN3', 'DNAJB1', 'CASP12', 'ERLEC1', 'SEC61G', 'SEC61B', 'SSR1', 'DNAJC5G', 'SSR2', 'UBXN8', 'MAN1A2', 'MAN1A1', 'UBXN4', 'UBXN6', 'MBTPS1', 'MBTPS2', 'BCAP31', 'DNAJC5B', 'SYVN1', 'UBE4B', 'SVIP', 'DNAJA2', 'DNAJA1', 'DAD1', 'CANX', 'MAN1B1', 'P4HB', 'DDIT3', 'STUB1', 'ERO1B', 'SEC23B', 'ERO1A', 'SEC23A', 'HSP90AB1', 'PRKCSH', 'DERL2', 'DERL3', 'DERL1', 'HERPUD1', 'LMAN1', 'LMAN2', 'SEC61A2', 'MAPK9', 'GANAB', 'MAPK8', 'OS9', 'SEC61A1', 'UBQLN2', 'MAN1C1', 'UBQLN1', 'BAK1', 'UFD1', 'FBXO6', 'UGGT2', 'UBQLN4', 'UGGT1', 'MARCHF6', 'UBQLN3']	171	5.742690058479532	0.5555555555555556	0.4444444444444444
